movie_code,movie_title,movie_genre,movie_director,movie_actor,movie_poster,movie_trailer,similar_movie,movie_story,story_keyword
129459,리틀 포레스트: 여름과 가을,['드라마'],모리 준이치,"['하시모토 아이', '마츠오카 마유', '미우라 타카히로']",https://movie-phinf.pstatic.net/20150114_206/1421200132061BpI2D_JPEG/movie_image.jpg,25867,"[37739, 149012, 39473, 66158, 125423, 114139, 147092, 38906, 64961]","도시에서 생활하다 쫓기듯 고향인 코모리로 돌아온 이치코.시내로 나가려면 한시간 이상이 걸리는 작은 숲 속 같은 그 곳에서 자급자족하며 농촌 생활을 시작한다.직접 농사지은 작물들과 채소, 그리고 제철마다 풍족하게 선물해주는 자연의 선물로 매일 정성껏 식사를 준비한다.음식을 먹으며 음식과 얽힌 엄마와의 추억을 문득 떠올리는 이치코에게 낯익은 필체의 편지가 도착하는데..","['생활', '식사', '고향', '자급자족', '자연', '농촌', '작물', '채소', '음식', '농사']"
74453,"혜화,동",['드라마'],민용근,"['유다인', '유연석']",https://movie-phinf.pstatic.net/20111223_14/1324632143867ts36G_JPEG/movie_image.jpg,14491,"[39619, 37488, 68258, 36666, 61095, 31267, 34969, 70651, 74565]","18살 고등학생 혜화와 한수는 서로 사랑하는 사이였지만, 혜화가 임신을 하자 한수는 홀연히 사라져 버렸다. 5년이 지난 어느 날, 그녀 앞에 한수가 나타난다. 그는 혜화에게 용서를 구하며, 죽은 줄 알았던 자신들의 아이가 살아있다는 소식을 전한다. 과거의 상처가 아물지 않은 혜화는 처음엔 그를 믿지 못하지만, 아이가 입양되었다는 사실을 알게 되면서 그녀의 마음은 걷잡을 수 없이 흔들린다.줄거리 2. 홀로 유기견을 기르는 여자 ‘혜화’의 이야기. ‘과거의 혜화’는 고교 시절 남자친구와의 사이에서 아이를 갖게 됐지만, 결국 아이도 남자친구도 떠나보내야만 했던 깊은 상처가 있다.제13회 프랑스 뚜르 아시안 영화제 - 심사위원 대상 수상(2012)제13회 프랑스 뚜르 아시안 영화제 - 여우주연상 수상(유다인, 2012)","['유기견', '프랑스', '여우주연상', '여자', '남자친구', '입양', '고등학생', '임신', '사랑', '용서']"
168045,바이스,['드라마'],아담 맥케이,['크리스찬 베일'],https://movie-phinf.pstatic.net/20190322_181/1553216483584eF8l2_JPEG/movie_image.jpg,42028,"[71509, 136845, 37488, 157178, 95808, 39908, 31827, 78672, 159516]","이것은 실화다, 그는 역사상 가장 비밀스러운 권력자였으므로 혹은 실화에 가까운 이야기다. 대기업의 CEO에서 펜타곤 수장을 거쳐 미국 부통령까지 오른 딕 체니(크리스찬 베일). 재임 시절, 보이지 않는 이면에서 그가 내린 결정들은 세계의 흐름을 바꿔 놓았고 뒤바뀐 역사는 다시는 회복될 수 없는 시간에 묻혀버렸다. 이제 그가 바꾼 글로벌한 역사의 변곡점들을 추적한다.","['부통령', '시절', '수장', '시간', '역사', '역사상', '세계', '글로벌', '권력자', '대기업']"
69689,셔터 아일랜드,"['드라마', '미스터리', '스릴러']",마틴 스콜세지,"['레오나르도 디카프리오', '마크 러팔로']",https://movie-phinf.pstatic.net/20111223_134/13246055676979Y0FT_JPEG/movie_image.jpg,12248,"[33755, 72043, 80774, 10746, 34969, 74565, 143456, 36957, 98483]","보스턴 셔터아일랜드의 정신병원에서 환자가 실종되는 사건이 발생한다. 연방보안관 테디 다니엘스(레오나르도 디카프리오)는 수사를 위해 동료 척(마크 러팔로)과 함께 셔터아일랜드로 향한다. 셔터 아일랜드에 위치한 이 병원은 중범죄를 저지른 정신병자를 격리하는 병동으로 탈출 자체가 불가능하다. 하지만 자식 셋을 죽인 혐의를 받고 있는 여인이 이상한 쪽지만을 남긴 채 감쪽같이 사라지고, 테디는 수사를 위해 의사, 간호사, 병원관계자 등을 심문하지만 모두 입이라도 맞춘 듯 꾸며낸 듯한 말들만 하고, 수사는 전혀 진척되지 않는다. 설상가상 폭풍이 불어 닥쳐 테디와 척은 섬에 고립되게 되고, 그들에게 점점 괴이한 일들이 일어나기 시작한다.","['심문', '탈출', '고립', '정신병원', '간호사', '환자', '혐의', '아일랜드', '중범죄', '정신병']"
136845,플로렌스,"['드라마', '코미디']",스티븐 프리어즈,"['메릴 스트립', '휴 그랜트', '사이몬 헬버그']",https://movie-phinf.pstatic.net/20160725_196/1469422765200RJrJ8_JPEG/movie_image.jpg,31711,"[47428, 109626, 71509, 39157, 157178, 40032, 118384, 152680, 68258]","세상에서 누구보다 노래를 좋아하지만 자신이 음치인 줄 모르는 귀여운 음치 소프라노 플로렌스그녀의 남편이자 플로렌스가 공연을 할 때마다 악평을 막느라 바쁜 사고전담 매니저 베이필드플로렌스의 노래에 충격을 받았지만 어느새 피아노를 치고 있는 음치맞춤형 연주자 맥문플로렌스는 자신감 하나로 세계 최고의 무대인 카네기홀 공연을 선언하고,그녀의 어마어마한 도전 앞에 베이필드와 맥문은 새로운 미션을 맞닥뜨리게 되는데…과연 이들은 무사히, 성공적으로 공연을 치를 수 있을까?","['도전', '남편', '사고', '연주자', '노래', '악평', '자신감', '성공', '피아노', '소프라노']"
74736,챔프,['드라마'],이환경,"['차태현', '유오성', '박하선']",https://movie-phinf.pstatic.net/20111223_272/1324642603980XLOcL_JPEG/movie_image.jpg,15717,"[34362, 93217, 140787, 31231, 95203, 159516, 63379, 103535, 31159]","시력을 잃어가는 기수와 절름발이 경주마 불가능을 뛰어넘는 기적의 감동실화!교통사고로 아내를 잃고 시신경을 다친 채 어린 딸(김수정)과 남겨진 기수 ‘승호’(차태현)와 같은 사고에서 새끼를 잃고 다리를 다쳐 더 이상 사람을 태우지 않는 경주마 ‘우박이’. 모두가 불가능하다고 생각했던 우승을 향한 무모한 도전. 올 추석, 기적의 감동실화가 시작된다!","['아내', '차태현', '김수정', '도전', '우승', '경주마', '추석', '기적', '사고', '교통사고']"
187787,너를 만난 여름,"['드라마', '멜로/로맨스']",장적사,"['진비우', '하람두']",https://movie-phinf.pstatic.net/20191016_285/1571192929545vzti3_JPEG/movie_image.jpg,43959,"[39636, 30685, 36957, 157178, 39157, 95808, 149777, 31231, 88474]","열일곱, 모든 게 서툴고 어설프지만 모든 게 좋았던 시간.너 ♡ 나 = 최고의 우리내가 가장 좋아하는 계절은‘너를 만난 여름’","['일곱', '여름', '계절', '시간', '가장', '모든', '우리', '만난', '최고']"
34501,실미도,"['전쟁', '스릴러', '드라마', '액션']",강우석,"['설경구', '안성기', '허준호']",https://movie-phinf.pstatic.net/20111222_50/1324503591769RwYSb_JPEG/movie_image.jpg,1693,"[51132, 93094, 59075, 31310, 22126, 64161, 96910, 36666, 44981]","{영화 &lt실미도&gt는 1968년 창설된 ‘실미도 684부대’에 관한 영화이며, 영화 속 훈련병들의 출신 성분이나 상황 설정이 과거 혹은 현재의 북파공작부대나 북파공작원과는 무관함을 알려드립니다.} 북으로 간 아버지 때문에 연좌제에 걸려 사회 어느 곳에서도 인간대접 받을 수 없었던 강인찬(설경구 분) 역시 어두운 과거와 함께 뒷골목을 전전하다가 살인미수로 수감된다. 그런  그 앞에 한 군인이 접근, '나라를 위해 칼을 잡을 수 있겠냐'는 엉뚱한 제안을 던지곤 그저 살인미수일 뿐인 그에게 사형을 언도하는데... 누군가에게 이끌려 사형장으로 향하던 인찬, 그러나 그가 도착한 곳은 인천 외딴 부둣가, 그곳엔 인찬 말고도 상필(정재영 분), 찬석(강성진 분), 원희(임원희 분), 근재(강신일 분) 등 시꺼먼 사내들이 잔뜩 모여 있었고 그렇게 1968년 대한민국 서부 외딴 섬 '실미도'에 기관원에 의해 강제차출된 31명이 모인다. 영문 모르고 머리를 깎고 군인이 된 31명의 훈련병들, 그들에게 나타난 의문의 군인은 바로 김재현 준위(안성기 분), 어리둥절한 그들에게 ""주석궁에 침투, 김일성 목을 따 오는 것이 너희들의 임무다""는 한 마디를 시작으로 냉철한 조중사(허준호 분)의 인솔하에 31명 훈련병에 대한 혹독한 지옥훈련이 시작된다. '684 주석궁폭파부대'라 불리는 계급도 소속도 없는 훈련병과 그들의 감시와 훈련을 맡은 기간병들... ""낙오자는 죽인다, 체포되면 자폭하라!""는 구호하에 실미도엔 인간은 없고 '김일성 모가지 따기'라는 분명한 목적만이 존재해간다. {조국의 부름에 목숨을 걸고 응답한 청년 기간병들과 분단 조국이 내몰았던 사지의 땅에서 자기 자리를 찾기 위해 울부짖으며 죽어간 서른 한 명 훈련병들의 영혼 앞에 이 영화를 바칩니다}","['살인', '강제', '지옥', '정재영', '자폭', '인천', '대한민국', '수감', '강신일', '김재현']"
34190,품행 제로,"['코미디', '멜로/로맨스']",조근식,"['류승범', '임은경', '공효진']",https://movie-phinf.pstatic.net/20111222_201/13245576028193CQgk_JPEG/movie_image.jpg,1080,"[39157, 95808, 66069, 10020, 66253, 88253, 39804, 34969, 12918]","모범시대, 불량영웅 중삘(feel)이가 왔다!. 은하 미용실의 외동아들이자 문덕고의 '쌈장'인 중필(류승범 분)의 하루 일과는 무척이나 고단하다. 물론, 일과 중 가장 중요한 것은 학교 가는 일. 일단 학교 조무래기들의 기대에 어느 정도 부응하기 위해선, 호시탐탐 그의 자리를 노리고 있을 무리들과 겨뤄 심심찮게 얘깃거리를 제공해야 하고, 비밀 아지트로 활용하고 있는 학교 옥상도 관리해야 한다. 그 뿐인가? 젊음과 문화의 상징인 로라장 관리며, 약간의 용돈벌이를 위한 춘화사업(?)까지... 그야말로 중필의 손길이 닿지 않는 곳이 없을 정도다. 덕분에 중필을 보좌하고 있는 수동(봉태규 분)과 넘버2의 자리를 고수하고 있는 단군파는 중필의 보호와 협박 속에서 평화롭게 공생관계를 유지하고 있다. 그러나 세상 거칠 것도 두려울 것도 없는 중필의 가슴에도 예기치 못한 큐피드의 화살이 날아와 박히고 말았으니... 이웃 여학교의 퀸카 민희(임은경 분)가 바로 그 주인공!! 하지만 그의 핑크빛 풋사랑이 제대로 피어날 겨를도 없이 안락했던 일상은 깨질 기미가 보이기 시작하는데... 어느 날 갑자기 태풍처럼 등장한 전학생 상만(김광일 분)이 그 일대를 초토화하며 주먹세계를 평정하려 한다는 소문이 그의 귀에도 들려온 것이다. 학교 아이들 뿐 만 아니라 그의 오른팔 수동마저도 또 하나의 전설이 될 중필과 상만의 격전을 내심 부추기고 기대하지만, 웬일인지 중필은 애써 상만과의 충돌을 피하려는 눈치다. 그러나 한 시대에 지존이 둘일 순 없는 법! 결전의 그 날은 다가오고... 한편 중필을 짝사랑 해온 오공주파 나영(공효진 분)은 민희가 중필과 가깝게 지낸다는 사실을 알게 되고, 그녀에게 온갖 공갈협박을 가해 보지만, 우습게만 여겼던 모범생 민희의 당돌함에, 만만치 않은 라이벌이 등장했음을 예감한다. 정란여고 최고의 모범생과 최고의 날라리. 어울리지 않는 연적이 되어버린 둘은 서로만의 방식으로 중필을 얻기 위한 사랑의 경쟁을 시작한다. 시간이 갈수록 전세는 악화되어 단군파 마저 상만에게 붙어 버리자 중필은 자신의 위기를 실감하고, 그 와중에 중필을 보호하겠다고 겁없이 나선 나영은 무모한 상만과의 싸움에 참패, 초죽음이 되어 돌아온다. 이제 문덕고 최강을 가릴 상만과의 대결은 피할 수 없는 대세가 된 듯하다. 드디어 결투의 카운트다운은 시작되고.. 과연 중필은 지존의 자리와 사랑, 두 마리 토끼를 다 지킬 수 있을 것인지?","['활용', '외동아들', '소문', '사업', '협박', '모범생', '젊음', '전학생', '경쟁', '학교']"
51781,슬픔보다 더 슬픈 이야기,"['멜로/로맨스', '드라마']",원태연,"['권상우', '이보영', '이범수']",https://movie-phinf.pstatic.net/20111223_273/13245757261955nr7N_JPEG/movie_image.jpg,10339,"[34969, 84414, 47428, 51132, 71509, 39473, 140787, 35071, 68258]","부모님에게 버림받은 라디오 PD 케이, 교통사고로 가족을 한날 한시에 모두 잃은 작사가 크림. 두 사람은 서로의 빈자리를 때로 가족처럼, 때로 친구처럼 메워주며 함께 살아가는 사이이다. 누구보다도 외로움을 많이 타는 크림… 케이는 그녀에게 줄 마지막 선물을 준비한다. 주환이 나타난다. 치과의사이고, 현명하고, 친절하고… 그리고 건강해서 크림을 평생 지켜줄 수 있을 것 같은 이 남자. 주환은 크림을 보고 첫눈에 사랑에 빠진다. 사랑을 이야기하지 않는 케이, 평생을 함께 하고 싶다는 주환. 그리고 그 두사람의 단 하나의 연인 크림. 서로 다른 세가지 방식의 사랑이 시작된다.","['선물', '교통사고', '빈자리', '친구', '부모님', '가족', '연인', '치과의사', '외로움', '사랑']"
75241,비우티풀,['드라마'],알레한드로 곤잘레스 이냐리투,"['하비에르 바르뎀', '마리셀 알바레즈', '에두아드 페르난데즈']",https://movie-phinf.pstatic.net/20111223_97/13246460649606Qw6B_JPEG/movie_image.jpg,16172,"[44981, 37759, 140787, 131637, 118384, 39584, 36957, 36565, 31231]","그럼에도 불구하고… 쓸쓸한 당신의 삶에, 아직 희망이 있다.. 나는 마약을 사고 팔고 밀입국자들을 짝퉁가방 공장에 알선하는 인력브로커다. 고질병 때문에 찾아간 병원에서 암이란다. 남은 시간 3개월.. 엄마의 우울증 때문에 못난 아빠와 함께 사는 나의 착한 두 아이는, 아직 어리다. 죽은 자와 대화할 수 있는 나의 특별한 능력은… 불행히도 나의 죽음을 보게 한다. 너무나 많은 이들에게 끔찍한 죄를 저질렀다. 마지막 순간, 실패한 인생이라 불릴 것이다. 하지만 내가 태어나기도 전에 죽은 얼굴도 모르는 아버지를 여전히 그리워하는 것처럼, 험한 세상을 남겨질 나의 아이들에게는 좋은 기억을, ‘아름다운’ 세상을 선물하고 싶다. 3개월.. 한달.. 하루.. 한 시간.. 일분.. 나의 아이들아, 미안하다.. 그럼에도 불구하고.. 살아야 한다.","['인생', '개월', '이란', '병원', '공장', '사고', '마약', '죽음', '질병', '우울증']"
38364,새벽의 저주,"['공포', '스릴러', '드라마', '액션']",잭 스나이더,"['사라 폴리', '빙 라메스', '제이크 웨버']",https://movie-phinf.pstatic.net/20111221_229/1324451496638076U7_JPEG/movie_image.jpg,2539,"[34969, 132933, 51132, 80774, 65242, 17150, 39619, 35071, 37439]","인간에 대한 신의 심판은 가끔은 혹독 할지도 모른다. 그래서 지옥을 꽉 차게 만들고 이  죽은 자들은  갈 곳이 없어 다시 지상으로 돌아와 살아 있는 인간을 사냥하기 시작한다. 어느날 새벽, 간호사 안나는  느닷없이 나타난  옆집 소녀에게 남편이 물어 뜯겨 죽는 참혹한 광경을 목격한다. 슬퍼하거나 놀랄 틈도 없이 죽었던 남편은 다시 되살아나 안나를 공격하고 안나는 급히 집 밖으로 도망쳐 나온다. 그러나 집밖에도 이미 같은 일들이 벌어지고 있었으며,  세상은 순식간에 생지옥으로 변하고 만다. 어디서 왔는지 정체를 알 수 없는 산 시체 들에게 한번 물리면 그 순간 물린 사람도 좀비로 변하고, 이런 연쇄작용으로 인해 도시는 혼이 없는 시체들에게 점령당하고 만다. 필사적으로 도망치던 안나는 몇몇 사람들과 함께 한 쇼핑몰 안으로 피신한다. 그러나  살아있는 인간들의 마지막 도피처라고도 할 수 있는 이 쇼핑몰도 그들의 안식처가 될 수 는 없었다. 극한 상황 속에 몰린 사람들이라 자신들의 의견을 내세우는 등 인간이 느낄 수 있는 최악의 갈등이 적나라하게 드러나게 된다. 설상가상으로 좀비들이 쇼핑 몰로 몰려오자 이들은 또 다른 도피처를 찾기 위하여 필사적인 탈출을 시도하게  되는데..","['쇼핑', '간호사', '시체', '갈등', '공격', '좀비', '최악', '사냥', '지옥', '생지옥']"
108734,필로미나의 기적,['드라마'],스티븐 프리어스,"['주디 덴치', '스티브 쿠건', '시모네 라비브']",https://movie-phinf.pstatic.net/20140305_233/1393983494616B1I2E_JPEG/movie_image.jpg,23198,"[35941, 39157, 56447, 49957, 51132, 31231, 78851, 37951, 45719]","50년 동안 충격적 비밀을 안고 살았던 필로미나가 아들을 찾기 위해 나섰다. 전직 BBC 기자 마틴은 이 흥미로운 소식을 접하고 그녀와 함께 ‘아들 찾기 프로젝트’에 나선다.   50년 만에 잃어버린 아들을 찾아나선 엄마와 특종을 쫓는 기자의 감동과 웃음 여행 수소문 끝에 그녀의 아들이 미국에 입양된 사실을 알게 되고. 필로미나는 난생 처음 아들을 만나기 위해 미국으로 떠날 결심을 한다. 하지만 무작정 아들의 행방을 쫓는 것에 점점 지쳐가고. 그러던 중 마틴은 그에 대해 놀라운 사실을 알게 되는데… 세상을 바꾼 눈부신 기적! 영화, 그 이상의 실화가 시작된다!","['웃음', '기자', '행방', '영화', '여행', '소문', '아들', '미국', '마틴', '입양']"
170859,"오늘 밤, 로맨스 극장에서","['판타지', '멜로/로맨스']",타케우치 히데키,"['아야세 하루카', '사카구치 켄타로']",https://movie-phinf.pstatic.net/20180611_153/15286846194454nqgC_JPEG/movie_image.jpg,39180,"[200896, 32126, 157178, 156912, 61848, 52747, 82283, 99724, 65113]","영화감독을 꿈꾸는 ‘켄지’.우연히 발견한 오래된 흑백 고전 영화 속 ‘미유키’ 공주를 동경하게 된 그는아무도 없는 극장에 남아 그녀가 나오는 영화를 혼자 감상하는 것이 일상이 된다.폭우가 몰아치던 어느 날, 그에게 영화보다 더 영화 같은 일이 벌어지게 되는데!바로 스크린 속 ‘미유키’ 공주가 현실 속으로 나타난 것.흑백 영화에서 막 튀어나온 말괄량이 ‘미유키’ 공주와 해피 엔딩을 꿈꾸는 순수 청년 ‘켄지’의신분(!), 컬러(!), 시공간을 초월한 아름다운 로맨스가 시작된다!","['시공간', '스크린', '현실', '영화감독', '폭우', '미유키', '로맨스', '영화', '극장', '공주']"
95808,위험한 패밀리,"['코미디', '범죄', '스릴러']",뤽 베송,"['로버트 드 니로', '미셸 파이퍼', '토미 리 존스']",https://movie-phinf.pstatic.net/20140115_163/13897758274388vpva_JPEG/movie_image.jpg,22581,"[71509, 66069, 71546, 35901, 39619, 39473, 64161, 36666, 51132]","범죄조직 보스 '프레드'(로버트 드 니로)가 그의 조직을 밀고했다!막강한 권력 버리고, 조직원에 쫓기는 신세가 된 전직 보스와 그의 가족들!퇴물 CIA요원 '스탠스필드'(토미 리 존스)는 증인보호 자격으로 이들 가족을 프랑스 작은 시골마을로 보내는데..조용해도 너무 조용한 시골마을!잠재울 수 없는 액션 본능이, 전직 보스 가족을 자극한다!'위험한 패밀리'에 의해 초토화가 될 위기에 빠진 평화로운 마을!과연, 위험한 패밀리는 액션 본능을 잠재우고 무사히 지낼 수 있을까?","['토미', '액션', '조직', '권력', '보호', '시골', '위기', '프랑스', '본능', '범죄']"
38384,우리 형,['드라마'],안권태,"['원빈', '신하균', '김해숙']",https://movie-phinf.pstatic.net/20111223_297/13245808608977LUGh_JPEG/movie_image.jpg,3587,"[39368, 159516, 51132, 103331, 33513, 134899, 129096, 39157, 17150]","1990년대 후반, 한 고등학교.. 같은 반에 연년생 형제가 재학중이다. 잘생긴 얼굴에 싸움까지 잘하는 '싸움 1등급' 동생-종현(원빈)과 한없이 다정하고 해맑은 '내신 1등급' 형-성현(신하균). 어린시절부터 형만 편애하던 어머니(김해숙) 때문에 17년째 교전중이던 형제는 어느날, 두형제가 동시에 인근지역 최고 퀸카-미령(이보영)에게 반하면서 2라운드에 돌입한다. 형제간에 그동안 참아왔던 감정이 폭발하며 대판 싸운 날, 성현은 그동안 동생에게 하지 못했던 말을 한다. “종현아! 내가 소원이 하나있는데.. 형이라고 한번만 불러줄래? 한번도 들어본 적이 없어서..."" 태어나 한번도 형을 형이라 부르지 않았던 동생과 동생이 자신의 첫사랑과 사귀는게 부러웠던 만큼, 자신만을 향한 어머니의 사랑이 부담스러웠던 만큼.. ...그만큼 동생에게 미안했던 형. 하지만 끝끝내 종현은 성현을 형이라 불러주지 않는데...","['재학', '이보영', '연년생', '첫사랑', '김해숙', '성현', '형제', '동생', '어린시절', '고등학교']"
148996,일주일간 친구,"['멜로/로맨스', '드라마']",무라카미 쇼스케,"['야마자키 켄토', '카와구치 하루나']",https://movie-phinf.pstatic.net/20171212_266/1513061579071pqajE_JPEG/movie_image.jpg,37242,"[78672, 31913, 157178, 159516, 109642, 31231, 39619, 47428, 103331]","""며칠만이라도, 너의 단 한사람이 되고 싶어”일주일이면 모든 기억이 리셋 되어 버리는 ‘후지미야’모든 친구관계를 단절한 채 자발적 외톨이로 교내 생활을 이어가던 그녀의 앞에일주일마다 똑 같은 고백을 하는 끈질긴 녀석, ‘하세’가 등장한다.“상관 없어. 월요일이 되면 변함없이 물어 볼게”굳게 닫힌 ‘후지미야’의 일상에 변화가 생기려던 그때,‘후지미야’의 오랜 친구 ‘하지메’가 그녀 앞에 나타나고깨질 듯 아프게 머리를 헤집는 기억들이 되살아 나기 시작하는데…‘후지미야’의 기억 너머에는 무슨 일이 있었던 걸까과연 ‘하세’는 ‘후지미야’와 일주일간 친구가 될 수 있을까?","['그녀', '친구', '너머', '모든', '생활', '외톨이', '일상', '단절', '고백', '월요일']"
159892,탐정: 리턴즈,"['코미디', '범죄']",이언희,"['권상우', '성동일', '이광수']",https://movie-phinf.pstatic.net/20180525_232/15272144254888eehd_JPEG/movie_image.jpg,38952,"[190244, 31231, 83213, 62263, 136872, 125447, 88461, 60548, 64126]","역대급 미제 사건을 해결한 추리 콤비, 셜록 덕후 만화방 주인 ‘강대만’(권상우)과 광역수사대 레전드 형사 ‘노태수’(성동일)! 드디어 대한민국 최초 탐정사무소를 개업하고, 전직 사이버 수사대 에이스 ‘여치’(이광수)까지 영입하며 탐정으로서의 첫 발을 내딛는다.하지만 꿈과 현실은 다른 법! 기다리는 사건 대신 파리만 날리고, 생활비 압박에 결국 경찰서까지 찾아가 몰래 영업을 뛰기 시작한다.드디어 기다림 끝에 찾아온 첫 의뢰인. 게다가 성공보수는 무려 5천만 원! 자신만만하게 사건을 받아 든 세 사람은 파헤칠수록 꼬리에 꼬리를 무는 의심스러운 증거들로 혼란에 빠지기 시작하는데…""우리가 가는 길 미제사건이란 없다""최강 트리플 콤비의 본격 추리가 시작된다!","['본격', '의뢰인', '해결', '영업', '탐정', '경찰서', '셜록', '만화방', '사이버', '대한민국']"
52245,바스터즈: 거친 녀석들,"['액션', '드라마', '전쟁']",쿠엔틴 타란티노,"['브래드 피트', '멜라니 로랑', '크리스토프 왈츠']",https://movie-phinf.pstatic.net/20111223_87/13245909373833oAeh_JPEG/movie_image.jpg,11329,"[68258, 31267, 64161, 34969, 74565, 31231, 37487, 37488, 36565]","독일이 무차별적으로 유대인을 학살하던 2차 세계 대전 시기,나치의 잔인하고 폭력적인 행태에 분개한 유대인 출신의 미군 알도 레인 중위(브래드 피트) 는‘당한 만큼 돌려준다!’는 강렬한 신념으로 그와 뜻을 함께 하는 사람들을 모아 ‘개떼들’이라는 조직을 만든다.각각의 분야에서 재능을 가진 조직원들을 모은 알도 레인은나치가 점령한 프랑스의 한 작은 마을에 위장 잠입해 당한 것에 몇 배에 달하는 피의 복수극을 시작하는데…","['조직', '무차별', '유대인', '폭력', '점령', '프랑스', '학살', '복수', '독일', '나치']"
