movie_code,movie_title,movie_genre,movie_director,movie_actor,movie_poster,movie_trailer,similar_movie,movie_story,story_keyword
192614,돈 룩 업,['코미디'],아담 맥케이,"['레오나르도 디카프리오', '제니퍼 로렌스', '롭 모건']",https://movie-phinf.pstatic.net/20211201_215/1638327180127D8wWx_JPEG/movie_image.jpg,51123,"[38823, 85633, 31629, 29571, 31913, 175322, 60530, 31778, 68063]","천문학과 대학원생 케이트 디비아스키(제니퍼 로렌스)와 담당 교수 랜들 민디 박사(레오나르도 디카프리오)는태양계 내의 궤도를 돌고 있는 혜성이 지구와 직접 충돌하는 궤도에 들어섰다는 엄청난 사실을  발견한다.하지만 지구를 파괴할 에베레스트 크기의 혜성이 다가온다는 불편한 소식에 아무도 신경 쓰지 않는다.지구를 멸망으로 이끌지도 모르는 소식을 사람들에게 알리기 위해 언론 투어에 나선 두 사람,혜성 충돌에 무관심한 대통령 올리언(메릴 스트립)과 그녀의 아들이자 비서실장 제이슨(조나 힐)의 집무실을 시작으로브리(케이트 블란쳇)와 잭(타일러 페리)이 진행하는 인기 프로그램 ‘더 데일리 립’ 출연까지 이어가지만 성과가 없다.혜성 충돌까지 남은 시간은 단 6개월, 24시간 내내 뉴스와 정보는 쏟아지고 사람들은 소셜미디어에 푹 빠져있는 시대이지만정작 이 중요한 뉴스는 대중의 주의를 끌지 못한다. 도대체 어떻게 해야 세상 사람들이 하늘을 좀 올려다볼 수 있을까?!","['소셜미디어', '충돌', '하늘', '스키', '지구', '멸망', '태양계', '궤도', '천문학', '혜성']"
38898,화이트 칙스,"['코미디', '범죄']",키넌 아이버리 웨이언스,"['숀 웨이언스', '마론 웨이언스', '제이미 킹']",https://movie-phinf.pstatic.net/20111222_175/1324500203068WSuLH_JPEG/movie_image.jpg,3438,"[47428, 40032, 39619, 151196, 187351, 31913, 34969, 73588, 74565]","위장술 하나는 끝내주지만 정작 사건 해결은 못해본 FBI 명물 콤비 마커스(말론 웨이언스)와 케빈(숀 웨이언스)은 순간의 착각으로 거물급 마약상을 놓치는 일대 실수를 저지르고 만다. FBI에서 퇴출 위기에 몰린 둘은 얼떨결에 자선파티 참석을 위해 LA에 오는 호텔재벌 윌슨가 자매의 모두가 꺼려하는 경호를 떠맡게 된다. 하지만 첫날부터 호틀갑 자매의 귀하신 얼굴에 상처를 내는 대형사고(?)를 치고 마는데... 길길이 날뛰는 자매 앞에 이들이 살아남는 방법은 딱 하나! '뽕 넣고 찍어 발라서라도' 그녀들로 변신, 그녀들 대신 사교계를 휘어잡는 것! 이제 풍만한 가슴에 쭉빠진 바디라인의 금발미녀가 된 그들, 아니 그녀들은 알고보면 첩보전을 능가하는 칵테일 파티와 총격전보다 살벌한 패션쇼 등 재벌계의 엄청난 사생활에 말려들기 시작하는데...?!","['재벌', '위기', '착각', '패션쇼', '마약상', '사고', '금발미녀', '파티', '자매', '실수']"
142634,내가 죽기 전에 가장 듣고 싶은 말,['코미디'],마크 펠링톤,"['셜리 맥클레인', '아만다 사이프리드', '앤쥴 리 딕슨']",https://movie-phinf.pstatic.net/20170724_122/1500858642631G900w_JPEG/movie_image.jpg,35206,"[97612, 65242, 62263, 39473, 51777, 53902, 12482, 95808, 35901]","은퇴한 광고 에이전시 보스 ‘해리엇’(셜리 맥클레인)은 자신의 사망기사를 미리 컨펌하기 위해 사망기사 전문기자인 ‘앤’(아만다 사이프리드)을 고용한다.하지만 해리엇의 까칠한 성격 탓에 주변 사람들은 모두 저주의 말만 퍼붓고, 좌절한 앤에게 해리엇은 뜻밖의 제안을 한다.완벽한 사망기사를 위해서 반드시 필요한 ‘고인은 동료들의 칭찬을 받아야 하고, 가족의 사랑을 받아야 하며, 누군가에게 우연히 영향을 끼쳐야 하고, 자신만의 와일드 카드가 있어야 한다’는 4가지 요소를 같이 찾자는 것!게다가 티격 대는 둘 사이에 말썽쟁이 문제소녀 ‘브렌다’까지 가세해 해리엇의 인생을 다시 써나가기 시작하는데…까칠한 80세 마녀, 마지막을 빛내줄 최고의 파트너를 만났다!","['가족', '동료', '고용', '말썽', '기자', '마녀', '사랑', '칭찬', '저주', '좌절']"
171533,콜레트,['드라마'],워시 웨스트모어랜드,"['키이라 나이틀리', '도미닉 웨스트']",https://movie-phinf.pstatic.net/20190327_10/1553664829865BN4HO_JPEG/movie_image.jpg,41989,"[73476, 39619, 70615, 72043, 12482, 36957, 99724, 118384, 98483]","프랑스 생 소뵈르 작은 마을의 소녀 콜레트바람둥이 소설 편집자 윌리와 사랑에 빠져 파리에 왔지만 기대만큼 행복하지 않다파리의 콧대 높은 사교계와 화려하기만 한 물랑루즈에 지쳐갈 무렵경제적 어려움에 처한 윌리의 부탁으로 자신의 경험을 녹인 소설을 쓰게 된다콜레트의 소설은 남편의 이름으로 출판되어 베스트셀러에 오르고급기야 소설 속 주인공 이름을 딴 브랜드까지 런칭,모든 상품들을 완판시키며 신드롬을 일으킨다패션, 헤어스타일까지 유행을 이끌며 최고의 인플루언서가 되지만모든 성공과 명예는 남편 윌리에게 돌아간다남편 뒤에 숨어있던 콜레트는 용기를 내어 자신의 존재를 드러내기로 결심하는데…더 이상 사랑을 위해 희생하지 않고,남들의 시선을 위해 치장하지 않기로 결심한 콜레트!그녀가 이제, 진짜 세상으로 당당히 걸어 나온다!","['어려움', '바람둥이', '주인공', '윌리', '파리', '사랑', '편집자', '출판', '베스트셀러', '소설']"
51282,용의자 X의 헌신,"['범죄', '드라마', '미스터리']",니시타니 히로시,"['후쿠야마 마사하루', '츠츠미 신이치', '시바사키 코우']",https://movie-phinf.pstatic.net/20111222_167/1324555404727AvIlI_JPEG/movie_image.jpg,10420,"[37759, 34969, 39619, 47428, 149777, 81967, 123268, 103331, 31231]","어느 날 형체를 알아볼 수 없는 남자의 시신이 발견된다. 사망자가 ‘토가시 신지’임이 판명되자, 그의 행적을 조사한 ‘우츠미’ 형사는 사건의 강력한 용의자로 전처 ‘야스코’를 지목한다. 하지만 그녀의 완벽한 알리바이에 수사의 한계에 부딪힌 우츠미는 천재 탐정 ‘갈릴레오’라 불리는 물리학자 ‘유카와’ 교수를 찾아가 도움을 요청한다. 사건의 전말을 확인한 유카와는 용의자의 옆집에 사는 남자가 대학시절 유일하게 수학 천재로 인정했던 동창 ‘이시가미’란 사실에 그가 야스코의 뒤에서 알리바이를 조작하고 있음을 직감한다. 그리고 이시가미와 접촉하며 의미심장한 말을 건넨다. “풀 수 없는 문제를 만드는 것과 그 문제를 푸는 것 중 어느 것이 더 어려울까? 단 정답은 반드시 있어.” 서서히 드러나는 천재 수학자의 치밀하고 완벽한 알리바이의 실체. 그리고 그 속에 숨겨진 한 남자의 뜨거운 헌신이 밝혀진다!","['직감', '대학시절', '우츠미', '시신', '용의자', '갈릴레오', '천재', '교수', '수학자', '물리학자']"
122527,캡틴 아메리카: 시빌 워,"['액션', 'SF', '스릴러']",안소니 루소,"['크리스 에반스', '로버트 다우니 주니어', '스칼릿 조핸슨']",https://movie-phinf.pstatic.net/20160427_273/1461725031863moaJw_JPEG/movie_image.jpg,30180,"[66728, 72363, 184318, 71546, 34969, 64161, 36666, 61095, 39619]",어벤져스 VS 어벤져스 분열은 시작되었다!어벤져스와 관련된 사고로 부수적인 피해가 일어나자 정부는 어벤져스를 관리하고 감독하는 시스템인 일명 ‘슈퍼히어로 등록제’를 내놓는다. 어벤져스 내부는 정부의 입장을 지지하는 찬성파(팀 아이언맨)와 이전처럼 정부의 개입 없이자유롭게 인류를 보호해야 한다는 반대파(팀 캡틴)로 나뉘어 대립하기 시작하는데...,"['정부', '대립', '인류', '개입', '사고', '분열', '반대파', '보호', '어벤져스', '슈퍼히어로']"
31565,브리짓 존스의 일기,"['드라마', '멜로/로맨스', '코미디']",샤론 맥과이어,"['르네 젤위거', '콜린 퍼스', '휴 그랜트']",https://movie-phinf.pstatic.net/20210421_169/1618982589882LFBPN_JPEG/movie_image.jpg,49395,"[30685, 66253, 39619, 34969, 109626, 31231, 131637, 61056, 39584]",어김없이 홀로 새해를 맞은 서른두 살 ‘브리짓’그런 그녀에게 운명처럼 찾아온 정반대의 두 매력남.내 여자에게만 다정한 스윗남 ‘마크’와사랑에 직진하는 ‘다니엘’ 사이에서그녀의 다이어리는 행복한 상상으로 채워지는데…‘브리짓 존스의 일기’ 첫 페이지가 시작됩니다.,"['다니엘', '정반대', '존스', '운명', '홀로', '서른', '새해', '매력', '스윗', '사랑']"
88426,건축학개론,['멜로/로맨스'],이용주,"['엄태웅', '한가인', '이제훈']",https://movie-phinf.pstatic.net/20120227_164/1330332687398PQ1U3_JPEG/movie_image.jpg,17228,"[103331, 74610, 68035, 39473, 149777, 17773, 187351, 151196, 68063]","생기 넘치지만 숫기 없던 스무 살, 건축학과 승민은 '건축학개론' 수업에서 처음 만난 음대생 서연에게 반한다. 함께 숙제를 하게 되면서 차츰 마음을 열고 친해지지만, 자신의 마음을 표현하는 데 서툰 순진한 승민은 입 밖에 낼 수 없었던 고백을 마음 속에 품은 채 작은 오해로 인해 서연과 멀어지게 된다. 어쩌면 다시…사랑할 수 있을까? 15년 만에 그녀를 다시 만났다서른 다섯의 건축가가 된 승민 앞에 15년 만에 불쑥 나타난 서연. 당황스러움을 감추지 못하는 승민에게 서연은 자신을 위한 집을 설계해달라고 한다. 자신의 이름을 건 첫 작품으로 서연의 집을 짓게 된 승민, 함께 집을 완성해 가는 동안 어쩌면 사랑이었을지 모를 그때의 기억이 되살아나 두 사람 사이에 새로운 감정이 쌓이기 시작하는데…","['고백', '수업', '당황', '설계', '오해', '사랑', '건축학', '건축학개론', '건축가', '숙제']"
40678,홀리데이,"['범죄', '드라마']",양윤호,"['이성재', '최민수']",https://movie-phinf.pstatic.net/20111222_93/1324558587016BnNf9_JPEG/movie_image.jpg,4857,"[140787, 12482, 78851, 68086, 66069, 43370, 39619, 12918, 74003]","1988년 10월... 올림픽이라는 세계적인 행사를 끝마치고 세계 4위라는 감흥에서 빠져 나오지 못했던 그 때... 징역 7년, 보호감호 10년형을 받아 복역중인 지강혁과 죄수들이 호송차를 전복 탈출하는 세상을 깜짝 놀라게 하는 사건이 발생한다. 권총 1정과 실탄을 빼앗아 무장탈주에 성공한 강혁과 일당들은 원정강도와 가정집을 돌며 인질극을 벌이는 등 서울을 공포의 도가니로 몰아넣는다. 하지만 인질로 잡힌 사람들은 매스컴에서 말하는 흉악범이라는 이야기와 달리 인간적이고 예의바른 강혁 일당에게 연민의 정을 느끼게 된다. 그렇게 탈주 9일째 되던 날, 북가좌동의 가정집에 숨어있던 강혁 일당은 자신들을 끈질기게 쫓던 경찰관 안석에게 발각되고 경찰과 최후의 대치극을 펼치게 된다. 강혁의 마지막 소원인 비지스의 'Holiday'가 울려 퍼지는 가운데 지강혁은 자신들을 둘러 싸고 있는 경찰과 매스컴을 향해 외친다. ""유전무죄, 무전유죄. 돈이 있으면 죄가 없고 돈이 없으면 죄가 된다..."" 강혁의 외침은 TV 등 매스컴을 통해 전국으로 울려 퍼지고, 강혁은 일당들과 함께 최후의 선택을 하게 되는데...","['유죄', '인질', '탈출', '외침', '강도', '징역', '흉악', '공포', '서울', '올림픽']"
59344,페인티드 베일,"['멜로/로맨스', '드라마']",존 커랜,"['나오미 왓츠', '에드워드 노튼']",https://movie-phinf.pstatic.net/20111222_245/1324501334516SXdy5_JPEG/movie_image.jpg,6743,"[31913, 78672, 36957, 51132, 70615, 39619, 68258, 74565, 66253]","1925년 영국 런던. 화려한 사교모임과 댄스파티를 즐기는 도도한 아가씨 키티(나오미 왓츠)와 그녀를 파티에서 보고 첫눈에 반해버린 차갑고 냉철한 성격의 월터(에드워드 노튼). 월터는 키티에게 청혼을 하고 키티는 자신을 숨막히게 하는 엄마의 그늘에서 벗어나고자 그의 청혼을 받아들인다. 세균학자인 월터의 연구 일정으로 인해 결혼 후 중국 상해로 넘어간 그들. 그러나 너무나 다른 성격과 다른 취향을 가진 두 사람의 결혼생활이 행복할 리 만무하다. 활발한 성격의 키티와 매사 너무나 진지하고 조용히 연구와 독서를 즐기는 월터의 사이는 점점 소원해지고 키티는 사교모임에서 만난 외교관과 사랑에 빠진다. 아내의 불륜을 눈치챈 월터는 콜레라가 퍼져있는 오지 산골마을에 자원해서 가고 그곳에 키티를 데려간다. 마치 자신의 믿음과 사랑의 배신에 대한 댓가를 치르게 하려는 듯. 문명의 혜택을 전혀 받지 못하고 콜레라로 인해 마을 사람의 태반이 죽어나가는 그곳에서 월터는 키티의 존재를 무시한 채 연구와 의료봉사에 전념하고 키티는 수감생활과 같은 나날을 보낸다. 무지로 인해 처음에 월터를 배척하던 마을 사람들은 그의 진심 어린 도움과 노력에 차츰 마음을 열고, 남을 위한 일이라고는 한번도 해본 적 없던 키티도 수녀원에서 아이들을 돌보며 봉사활동을 시작한다. 그리고 두 사람의 마음은 차츰 서로를 향해 열리고 키티와 월터는 진정으로 서로를 사랑하게 되지만 이내 슬픈 운명이 그들의 행복을 가로 막는데...","['행복', '외교관', '세균학자', '사랑', '수녀원', '키티', '아내', '파티', '댄스파티', '결혼']"
86818,버니드롭,"['드라마', '코미디']",다나카 히로유키,"['마츠야마 켄이치', '아시다 마나', '카리나']",https://movie-phinf.pstatic.net/20120419_261/1334802941606bC9zY_JPEG/movie_image.jpg,17599,"[12482, 31475, 38906, 39473, 99714, 34969, 131637, 84414, 74610]",외할아버지의 죽음으로 몇 년 만에 고향집에 내려온 다이키치. 하지만 외할아버지에게 숨겨놓은 딸 린이 있었다는 사실에 온 집안은 발칵 뒤집혀 있었다. 게다가 린의 나이는 겨우 여섯 살! 엄마 되는 사람은 흔적조차 없고 린의 양육 문제를 서로 미루려고만 하는 친척들의 이기적인 태도에 다이키치는 폭발하고 만다. 욱하는 심정으로 린에게 자신의 집으로 오라고 한 다이키치.과연 다이키치는 린을 잘 키울 수 있을까? 그리고 린은 다이키치를 믿고 따를 수 있을까?두 사람만의 특별하고 색다른 러브스토리가 시작된다!,"['양육', '여섯', '문제', '겨우', '폭발', '고향', '집안', '죽음', '러브스토리', '친척']"
107928,퓨리,"['액션', '드라마', '전쟁']",데이비드 에이어,"['브래드 피트', '로건 레먼', '샤이아 라보프']",https://movie-phinf.pstatic.net/20141105_67/1415155139518WWeIr_JPEG/movie_image.jpg,25246,"[103331, 39473, 139674, 47428, 66253, 74003, 63017, 31913, 51132]","2차 세계대전, 전차부대를 이끄는 대장 ‘워대디’에게 적으로 둘러싸인 최전선에서의 마지막 전투 명령이 떨어진다. 하지만 수 차례의 전투로 대부분의 동료를 잃은 그에겐  단 한 대의 탱크 ‘퓨리’와 지칠 대로 지쳐버린 부대원들만이 남아있을 뿐이다.게다가 지원군으로 경력이 전무한 신병 ‘노먼’이 배치되고, ‘워대디’는 신참을 포함한 단 4명의 부대원만으로 적진에 나서야 하는 상황에 처한다. 수백 명의 적들과 맞서야 하는 단 5인의 병사. 최소의 인원과 최악의 조건 속, 사상 최대 위기에 처한 ‘워대디’와 그의 부대는 생존 가능성 제로, 최후의 전쟁터로 향하는데…! 역사를 바꾼 그들의 불가능한 전쟁이 시작된다!","['적진', '최악', '역사', '동료', '탱크', '수백', '생존', '세계대전', '전쟁', '전투']"
39473,래더 49,"['액션', '드라마', '스릴러']",제이 러셀,"['호아킨 피닉스', '존 트라볼타', '재신다 바렛']",https://movie-phinf.pstatic.net/20111223_251/1324575573694JbqTF_JPEG/movie_image.jpg,3722,"[47428, 51132, 68258, 71509, 64161, 35071, 37487, 74565, 31231]","몸을 사리지않고 소중한 생명들을 구해낸 잭(호아킨 피닉스)과 그의 인생 선배이자 소방서장인 마이크 케네디(존 트라볼타 분)... 일상에서의 그들은 한 여자의 남편이자 아이들의 아빠, 좋은 친구, 따뜻한 이웃이지만 출동 사이렌이 울리는 순간, 그들은 타인의 운명을 바꾸는 막대한 힘을 지닌 존재가 된다. 하지만... 아침에 출근하는 남편이 저녁에 무사히 살아돌아오기를 기도하며 매일 같이 맘조려야하는 아내, 아버지가 죽음의 현장에서 사투를 벌이는 모습을 지켜보며 두려움과 싸워야하는 가족들... 엄청난 불길 속으로 사라져버린 절친한 동료들... 마냥 자랑스럽기만 했던 일은 어느덧 감당하기 벅찬 슬픔을 불러온다. 그러던 어느날... 여느때처럼 생존자를 구출하려던 잭은 뜻하지 않은 사고로 불길속에 갇히게 되고, 마이크는 그를 구출하기위해 수단과 방법을 가리지 않는다. 폭발 직전의 건물... 불길 속에서 사투를 벌이는 잭과 그를 구하기 위해 건물 밖에서 또 다른 사투를 벌이는 마이크... 과연 그들의 운명은 어떻게 될 것인가...?","['남편', '출근', '두려움', '운명', '사고', '생존자', '죽음', '동료', '가족', '슬픔']"
63379,영원한 여름,"['드라마', '멜로/로맨스']",레스티 첸,"['장예가', '장효전', '양기']",https://movie-phinf.pstatic.net/20111221_49/1324473613655JRz8k_JPEG/movie_image.jpg,7249,"[36666, 37488, 51132, 39619, 64161, 31788, 37487, 39584, 129406]","‘캉정싱’과 ‘위샤우헝’은 해안가의 작은 초등학교에서 처음 만났다. ‘위샤우헝’은 학급 최고의 말썽꾸러기, 반면 ‘캉정싱’은 학급반장까지 맡고 있을 만큼 최고의 우등생. 어느 날 담임선생님은  “작은 수호천사”를 ‘캉정싱’에게 제안하는데, 그것은 바로 모범학생이 문제학생의 친구가 되어 바른길로 이끄는 것. ‘반장’의 의무감으로 그 제안에 흔쾌히 동참한 ‘캉정싱’은 그렇게 타의 반, 자의 반으로 ‘위샤우헝’과 단짝 친구가 된다. 이렇게 시작된 두 소년의 어색한 우정은, 차츰 알 수 없는 감정으로 이어지게 되는데... 영화제 소개글. 성장영화의 틀을 빈 퀴어 시네마, 또는 퀴어 시네마의 틀을 빈 성장영화. 어린 시절부터 함께 자란 쩡싱과 슈헹, 그리고 그들의 여자친구인 후이지아는 대학 입시를 앞두고 미묘한 감정의 변화를 겪는다. 쩡싱은 자신이 슈헹을 사랑하고 있음을 깨닫고 후이지아와 거리를 두기 시작하고, 슈헹은 후이지아를 사랑하기 시작한다. 하지만, 후이지아는 두 사람의 억눌린 사랑의 감정을 알게 되고 그 사이에서 갈등을 하게 된다.","['수호천사', '의무감', '친구', '우정은', '사랑', '바른길', '학급', '여자친구', '초등학교', '학생']"
167613,조커,"['스릴러', '드라마']",토드 필립스,['호아킨 피닉스'],https://movie-phinf.pstatic.net/20190906_128/1567761736426S6Fje_JPEG/movie_image.jpg,43821,"[37488, 39908, 51132, 37487, 139674, 65113, 70615, 134899, 174301]",고담시의 광대 아서 플렉은 코미디언을 꿈꾸는 남자.하지만 모두가 미쳐가는 코미디 같은 세상에서맨 정신으로는 그가 설 자리가 없음을 깨닫게 되는데…이제껏 본 적 없는 진짜 ‘조커’를 만나라!,"['모두', '정신', '진짜', '이제껏', '세상', '조커', '남자', '광대', '코미디', '코미디언']"
17150,유주얼 서스펙트,"['범죄', '스릴러', '미스터리']",브라이언 싱어,"['스티븐 볼드윈', '가브리엘 번']",https://movie-phinf.pstatic.net/20160921_176/1474434618922blNjV_JPEG/movie_image.jpg,32258,"[39619, 39473, 64161, 103331, 36666, 51132, 71509, 34969, 47428]","산페드로 부두 폭발 사고,유일한 생존자, 사라진 수천 만 달러!그리고 베일에 가려진 인물 ‘카이저 소제’…수사관 데이브 쿠얀은 유일한 생존자인 ‘버벌’로부터폭발 사고의 유력한 용의자로 지목되었던 5인에 대한 진술을 듣는다.‘버벌’의 진술과 함께 속속 드러나는 지난 6주간 있었던 그들의 화려한 범죄 행각,하지만 정작 용의자들도 모르게 그들 위에 존재했던 전설 속 악마 ‘카이저 소제’의 존재가 부각되며 쿠얀은 혼란에 빠진다...치밀한 설계, 완벽하게 짜여진 범죄시간을 거스른 치열한 두뇌싸움이 시작된다!","['폭발', '혼란', '수천', '사고', '싸움', '생존자', '악마', '용의자', '전설', '범죄']"
164719,플로리다 프로젝트,['드라마'],션 베이커,"['윌렘 대포', '브루클린 프린스', '브리아 비나이트']",https://movie-phinf.pstatic.net/20180130_229/1517276941579AqYLj_JPEG/movie_image.jpg,37822,"[31371, 65290, 34093, 37386, 39908, 51132, 144578, 84349, 48742]","""안심하세요 나랑 있으면 안전해요""플로리다 디즈니월드 건너편 ‘매직 캐슬’에 사는귀여운 6살 꼬마 ‘무니’와 친구들의디즈니월드 보다 신나는 무지개 어드벤처!","['캐슬', '안심', '매직', '무니', '꼬마', '친구', '무지개', '플로리다', '어드벤처', '디즈니월드']"
66795,잠수종과 나비,['드라마'],줄리안 슈나벨,"['마티유 아말릭', '엠마누엘 자이그너', '마리 조지 크로즈']",https://movie-phinf.pstatic.net/20201103_246/1604385227530b53Ib_JPEG/movie_image.jpg,47653,"[101953, 65902, 102272, 179430, 190244, 134859, 31231, 109626, 66158]",유명 잡지 ‘엘르’ 편집장으로남부럽지 않은 인생을 즐기던 장 도미니크 보비갑작스러운 뇌졸중으로 온몸이 마비되고신체 중 유일하게 왼쪽 눈꺼풀만 움직일 수 있게 된다자유롭던 몸짓이 한순간 잠수종에 갇힌 남자하지만 기억과 상상력에 날개를 달아새로운 도약을 시작하는데…침묵 속에서 세상을 써 내려간 남자의아름다운 실화가 시작된다!,"['눈꺼풀', '왼쪽', '한순간', '잠수종', '유명', '침묵', '남자', '상상력', '마비', '뇌졸중']"
17062,세븐,"['범죄', '스릴러']",데이빗 핀처,"['브래드 피트', '모건 프리먼']",https://movie-phinf.pstatic.net/20161010_61/1476063576511DfVBh_JPEG/movie_image.jpg,32363,"[38097, 68695, 47587, 45719, 35071, 64161, 39473, 109642, 55405]","은퇴를 7일 앞둔 관록의 형사 윌리엄 소머셋(모건 프리먼)과 새로 전근 온 신참내기 형사 밀스(브래드 피트)가 팀이 된 바로 다음날,강압에 의해 위가 찢어질 때까지 먹다가 죽은 초고도 비만 남자와 역시 강압에 의해 식칼로 자기 살을 베어내 죽은 악덕 변호사의 사건과 마주한다.‘식탐’, ‘탐욕’… 그리고 ‘나태’, ‘분노’, ‘교만’, ‘욕정’. ‘시기’ 윌리엄 소머셋은 현장에 남은 흔적들로 기나긴 연쇄 살인이 시작되었음을 직감하고성서의 7가지 죄악을 따라 발생하는 사건들을 추적하기 시작하는데…가장 치밀한 일곱 개의 연쇄살인이 시작된다!","['직감', '비만', '교만', '분노', '악덕', '욕정', '살인', '연쇄살인', '식탐', '탐욕']"
