movie_code,movie_title,movie_genre,movie_director,movie_actor,movie_poster,movie_trailer,similar_movie,movie_story,story_keyword
171539,그린 북,['드라마'],피터 패럴리,"['비고 모텐슨', '마허샬라 알리']",https://movie-phinf.pstatic.net/20190115_228/1547528180168jgEP7_JPEG/movie_image.jpg,41189,"[10020, 25906, 17059, 34969, 44885, 70615, 18285, 82283, 69339]","1962년 미국, 입담과 주먹만 믿고 살아가던 토니 발레롱가(비고 모텐슨)는 교양과 우아함 그 자체인천재 피아니스트 돈 셜리(마허샬라 알리) 박사의 운전기사 면접을 보게 된다.백악관에도 초청되는 등 미국 전역에서 콘서트 요청을 받으며 명성을 떨치고 있는 돈 셜리는위험하기로 소문난 미국 남부 투어 공연을 떠나기로 결심하고,투어 기간 동안 자신의 보디가드 겸 운전기사로 토니를 고용한다.거친 인생을 살아온 토니 발레롱가와 교양과 기품을 지키며 살아온 돈 셜리 박사.생각, 행동, 말투, 취향까지 달라도 너무 다른 두 사람은그들을 위한 여행안내서 ‘그린북’에 의존해 특별한 남부 투어를 시작하는데…","['면접', '초청', '발레', '공연', '여행안내서', '남부', '백악관', '피아니스트', '투어', '콘서트']"
174830,가버나움,['드라마'],나딘 라바키,"['자인 알 라피아', '요르다노스 시프로우']",https://movie-phinf.pstatic.net/20190109_149/1546998123676c6LjJ_JPEG/movie_image.jpg,41194,"[53152, 89627, 49380, 79315, 47428, 123268, 49957, 76452, 37439]","나를 세상에 태어나게 한 ""부모님을 고소하고 싶어요...""-출생기록조차 없이 살아온 어쩌면 12살 소년 '자인'으로부터","['자인', '기록', '세상', '어쩌면', '출생', '소년', '부모님']"
144906,베일리 어게인,"['모험', '코미디', '드라마']",라세 할스트롬,"['조시 게드', '데니스 퀘이드', 'K.J. 아파']",https://movie-phinf.pstatic.net/20181031_264/1540949415228uy0j3_JPEG/movie_image.jpg,40364,"[36666, 187351, 79770, 62249, 64161, 39473, 65113, 129383, 66253]","귀여운 소년 ‘이든’의 단짝 반려견 ‘베일리’는 행복한 생을 마감한다.하지만 눈을 떠보니 다시 시작된 견생 2회차, 아니 3회차?!1등 경찰견 ‘엘리’에서 찰떡같이 마음을 알아주는 소울메이트 ‘티노’까지!다시 태어날 때마다 성별과 생김새, 직업(?)에 이름도 바뀌지만,여전히 영혼만은 사랑 충만! 애교 충만! 주인바라기 ‘베일리’어느덧 견생 4회차, 방랑견이 되어 떠돌던 ‘베일리’는마침내 자신이 돌아온 진짜 이유를 깨닫고 어딘가로 달려가기 시작하는데…","['티노', '단짝', '진짜', '찰떡', '소년', '일리', '주인', '방랑견', '반려견', '사랑']"
151196,원더,['드라마'],스티븐 크보스키,"['제이콥 트렘블레이', '줄리아 로버츠', '오웬 윌슨']",https://movie-phinf.pstatic.net/20210201_56/16121602734716k8oV_JPEG/movie_image.jpg,37112,"[12918, 96910, 68258, 39619, 34969, 140787, 47428, 103331, 31231]","누구보다 위트 있고 호기심 많은 매력 부자 ‘어기'(제이콥 트렘블레이).하지만 남들과 다른 외모로 태어난 ‘어기'는 모두가 좋아하는 크리스마스 대신 얼굴을 감출 수 있는 할로윈을 더 좋아한다.10살이 된 아들에게 더 큰 세상을 보여주고 싶었던 엄마 ‘이사벨’(줄리아 로버츠)과 아빠 ‘네이트’(오웬 윌슨)는 ‘어기'를 학교에 보낼 준비를 하고, 동생에게 모든 것을 양보해왔지만 누구보다 그를 사랑하는 누나 ‘비아'도 ‘어기'의 첫걸음을 응원해준다.그렇게 가족이 세상의 전부였던 ‘어기'는 처음으로 헬멧을 벗고 낯선 세상에 용감하게 첫발을 내딛지만 첫날부터 ‘남다른 외모'로 화제의 주인공이 되고, 사람들의 시선에 큰 상처를 받는다.그러나 ‘어기'는 27번의 성형(?)수술을 견뎌낸 긍정적인 성격으로 다시 한번 용기를 내고, 주변 사람들도 하나둘 변하기 시작하는데...","['할로윈', '용기', '사랑', '동생', '가족', '학교', '낯선', '호기심', '부자', '크리스마스']"
169240,아일라,"['드라마', '전쟁']",잔 울카이,"['김설', '이스마일 하지오글루']",https://movie-phinf.pstatic.net/20180524_108/1527129319423XRTcI_JPEG/movie_image.jpg,39091,"[34969, 31231, 39473, 31913, 140787, 47428, 39619, 12918, 35071]","1950년 한국전쟁에 파병된 ‘슐레이만’은 칠흑 같은 어둠 속 홀로 남겨진 5살 소녀를 발견한다.전쟁과 부모를 잃은 충격 속에 말을 잃은 소녀. ‘슐레이만’은 소녀에게 터키어로 ‘달’이라는 뜻의 ‘아일라’라는 이름을 지어주고 함께 부대로 향한다. 서로에게 무엇과도 바꿀 수 없는 가장 소중한 존재가 된 두 사람. 그러나 행복도 잠시, ‘슐레이만’은 종전과 함께 고국으로 돌아가라는 명령을 받게 되고, ‘아일라’를 끝까지 지켜내기 위해 모두의 반대 속에 자신의 선택을 감행하게 되는데…전 세계를 감동시킨 위대한 이야기가 찾아온다!","['반대', '전쟁', '종전', '홀로', '터키어', '어둠', '소녀', '한국', '행복', '부모']"
157243,당갈,"['드라마', '액션']",니테쉬 티와리,"['아미르 칸', '파티마 사나 셰이크', '산야 말호트라']",https://movie-phinf.pstatic.net/20180329_2/1522287706725roSen_JPEG/movie_image.jpg,38356,"[70615, 85351, 63017, 47428, 73588, 79315, 75006, 53902, 125447]","전직 레슬링 선수였던 ‘마하비르 싱 포갓(아미르 칸)’은 아버지의 반대로 금메달의 꿈을 이루지 못한 채 레슬링을 포기한다.아들을 통해 꿈을 이루겠다는 생각은 내리 딸만 넷이 태어나면서 좌절된다.그러던 어느 날, 두 딸이 또래 남자아이들을 신나게 때린 모습에서 잠재력을 발견하고 레슬링 특훈에 돌입한다.사람들의 따가운 시선과 조롱에도 불구하고 첫째 기타(파티마 사나 셰이크)와 둘째 바비타(산야 말호트라)는아버지의 훈련 속에 재능을 발휘, 승승장구 승리를 거두며 국가대표 레슬러로까지 성장해 마침내 국제대회에 출전하는데...","['아버지', '특훈', '잠재력', '재능', '대회', '레슬링', '훈련', '금메달', '좌절', '조롱']"
181710,포드 V 페라리,"['액션', '드라마']",제임스 맨골드,"['맷 데이먼', '크리스찬 베일']",https://movie-phinf.pstatic.net/20191204_91/15754257752042kHvB_JPEG/movie_image.jpg,43976,"[33513, 42690, 31475, 38083, 32126, 36666, 70651, 39157, 12918]","1960년대, 매출 감소에 빠진 ‘포드’는 판매 활로를 찾기 위해스포츠카 레이스를 장악한 절대적 1위 ‘페라리’와의 인수 합병을 추진한다.막대한 자금력에도 불구, 계약에 실패하고 엔초 페라리로부터 모욕까지 당한 헨리 포드 2세는르망 24시간 레이스에서 페라리를 박살 낼 차를 만들 것을 지시한다. 불가능을 즐기는 두 남자를 주목하라!세계 3대 자동차 레이싱 대회이자 ‘지옥의 레이스’로 불리는 르망 24시간 레이스.출전 경험조차 없는 ‘포드’는 대회 6연패를 차지한 ‘페라리’에 대항하기 위해르망 레이스 우승자 출신 자동차 디자이너 ‘캐롤 셸비’(맷 데이먼)를 고용하고, 그는 누구와도 타협하지 않지만 열정과 실력만큼은 최고인 레이서 ‘켄 마일스’(크리스찬 베일)를 자신의 파트너로 영입한다.포드의 경영진은 제 멋대로인 ‘켄 마일스’를 눈엣가시처럼 여기며자신들의 입맛에 맞춘 레이스를 펼치기를 강요하지만두 사람은 어떤 간섭에도 굴하지 않고 불가능을 뛰어넘기 위한 질주를 시작하는데…그 어떤 각본보다 놀라운 실화가 펼쳐진다!","['고용', '디자이너', '열정', '모욕', '레이싱', '매출', '우승자', '연패', '포드', '스포츠카']"
17421,쇼생크 탈출,['드라마'],프랭크 다라본트,"['팀 로빈스', '모건 프리먼']",https://movie-phinf.pstatic.net/20160119_278/14531650465287bcuk_JPEG/movie_image.jpg,30006,"[71546, 34093, 147388, 51132, 31310, 146560, 60548, 72043, 10020]","촉망 받던 은행 부지점장 ‘앤디(팀 로빈슨 分)’는 아내와 그 애인을 살해한 혐의로 종신형을 받고 쇼생크 교도소에 수감된다.강력범들이 수감된 이곳에서 재소자들은 짐승 취급 당하고, 혹여 간수 눈에 잘못 보였다가는 개죽음 당하기 십상이다.처음엔 적응 못하던 ‘앤디’는 교도소 내 모든 물건을 구해주는 ‘레드(모건 프리먼 分)’와 친해지며 교도소 생활에 적응하려 하지만, 악질 재소자에게 걸려 강간까지 당한다.그러던 어느 날, 간수장의 세금 면제를 도와주며 간수들의 비공식 회계사로 일하게 되고, 마침내는 소장의 검은 돈까지 관리해주게 된다.덕분에 교도소 내 도서관을 열 수 있게 되었을 무렵, 신참내기 ‘토미(길 벨로우스 分)’로부터 ‘앤디’의 무죄를 입증할 기회를 얻지만, 노튼 소장은 ‘앤디’를 독방에 가두고 ‘토미’를 무참히 죽여버리는데...","['로빈슨', '도서관', '애인', '혐의', '짐승', '회계사', '강간', '수감', '교도소', '개죽음']"
10200,터미네이터 2:오리지널,"['SF', '액션', '스릴러']",제임스 카메론,['아놀드 슈왈제네거'],https://movie-phinf.pstatic.net/20191010_99/1570669194041iWfdl_JPEG/movie_image.jpg,43824,"[39619, 66069, 96910, 68258, 72043, 36666, 95808, 47428, 36957]","미래, 인류와 기계의 전쟁은 계속 되는 가운데 스카이넷은 인류 저항군 사령관 존 코너를 없애기 위해액체 금속형 로봇인 T-1000을 과거의 어린 존 코너에게로 보낸다. 미래의 인류 운명을 쥔 어린 존 코너. 스카이넷의 T-1000은 거침없이 숨 가쁜 추격을 시작하는데…","['저항', '과거', '인류', '운명', '스카이', '미래', '전쟁', '기계', '금속', '로봇']"
154667,덕구,['드라마'],방수인,"['이순재', '정지훈']",https://movie-phinf.pstatic.net/20180312_10/1520835949152TqOUm_JPEG/movie_image.jpg,37972,"[191917, 51781, 164684, 34969, 38572, 96910, 45719, 164932, 31606]","어린 손자와 살고 있는 일흔 살 덕구 할배는자신에게 주어진 시간이 얼마 남지 않음을 알게 된다.세상에 덩그러니 남겨질 두 아이들을 위해할배는 자신을 대신할 사람을 찾아주기로 하고,홀로 먼 길을 떠나 특별한 선물을 준비하는데..","['위해', '얼마', '대신', '덕구', '홀로', '일흔', '세상', '선물', '시간', '손자']"
35939,클래식,"['멜로/로맨스', '드라마']",곽재용,"['손예진', '조승우', '조인성']",https://movie-phinf.pstatic.net/20111222_233/1324486884038nu8Xk_JPEG/movie_image.jpg,1125,"[35071, 39619, 40208, 40032, 78672, 66728, 123268, 38906, 37759]","같은 대학에 다니는 지혜(손예진)와 수경은 연극반 선배 상민(조인성)을 좋아한다. 하지만 호들갑스런 수경이 상민에게 보낼 편지의 대필을 부탁하고, 지혜는 수경의 이름으로 상민을 향한 자신의 감정을 고백한다. 지혜의 편지로 맺어진 수경과 상민이 가까워지면서 지혜는 괜한 죄의식에 상민을 멀리 하려 하지만, 우연하게도 자꾸만 마주치게 된다. 오래 전, 사랑은 이미 시작되었다... 한편, 아빠를 일찍 여읜 지혜는 지금은 해외 여행 중인 엄마 주희와 단둘이 살다. 엄마의 빈자리를 털기 위해 다락방을 청소하던 지혜는 우연히 엄마의 비밀 상자를 발견하게 된다. 주희의 첫사랑의 기억이 고스란히 담겨있는 비밀 상자를 보면서 지혜는 엄마의 클래식한 사랑을 조금씩 알게 된다. 귀를 기울이면, 그들의 안타까운 사랑이 들려온다!! 1968년 여름... 방학을 맞아 시골 삼촌댁에 간 준하(조승우)는 그곳에서 성주희(손예진)를 만나, 한눈에 그녀에게 매료된다. 그런 주희가 자신에게만 은밀하게 '귀신 나오는 집'에 동행해줄 것을 부탁해온다. 흔쾌히 수락한 준하는 흥분된 마음을 가까스로 누르며 주희와의 약속 장소에 나간다. 그런데 갑작스런 소나기를 만나 배가 떠내려가면서 귀가 시간이 늦어지고, 이 일로 주희는 집안 어른에게 심한 꾸중을 듣고 수원으로 보내진다. 작별 인사도 못하고 헤어진 주희를 향한 준하의 마음은 안타깝기만 하다. 그렇게 방학이 끝나고 학교로 돌아온 준하는 친구 태수에게 연애편지의 대필을 부탁받는데, 상대가 주희란 사실에 깜짝 놀란다. 하지만 태수에게 그 사실을 말하지 못하고, 태수의 이름으로 자신의 마음을 담아 주희에게 편지를 쓴다. 운명이 던져준 또 한번의 인연 편지를 대신 써주며 사랑이 깊어간 엄마와 자신의 묘하게도 닮은 첫사랑. 이 우연의 일치에 내심 의아해하는 지혜는 상민에 대한 생각이 더욱 깊어만 간다. 하지만 이미 친구의 연인이 되어버린 그를 포기하기로 마음먹는데...","['친구', '하의', '우연', '조인성', '인연', '연인', '사랑', '매료', '연애편지', '지혜']"
156464,보헤미안 랩소디,['드라마'],브라이언 싱어,"['라미 말렉', '루시 보인턴', '귈림 리']",https://movie-phinf.pstatic.net/20181213_264/1544692854634ss65r_JPEG/movie_image.jpg,40441,"[51132, 139674, 39473, 74565, 70254, 157178, 32126, 72043, 85351]","공항에서 수하물 노동자로 일하며 음악의 꿈을 키우던 이민자 출신의 아웃사이더 ‘파록버사라’보컬을 구하던 로컬 밴드에 들어가게 되면서 ‘프레디 머큐리’라는 이름으로 밴드 ‘퀸’을 이끌게 된다. 시대를 앞서가는 독창적인 음악과 화려한 퍼포먼스로 관중들을 사로잡으며 성장하던 ‘퀸’은 라디오와 방송에서 외면을 받을 것이라는 음반사의 반대에도 불구하고 무려 6분 동안 이어지는 실험적인 곡 ‘보헤미안 랩소디’로 대성공을 거두며 월드스타 반열에 오른다.그러나 독보적인 존재감을 뿜어내던 ‘프레디 머큐리’는 솔로 데뷔라는 유혹에 흔들리게 되고결국 오랜 시간 함께 해왔던 멤버들과 결별을 선언하게 되는데…세상에서 소외된 아웃사이더에서 전설의 록밴드 ‘퀸’이 되기까지,우리가 몰랐던 그들의 진짜 이야기가 시작된다!","['퍼포먼스', '실험', '보컬', '밴드', '음반사', '랩소디', '음악', '전설', '라디오', '유혹']"
10102,사운드 오브 뮤직,"['멜로/로맨스', '뮤지컬', '드라마']",로버트 와이즈,"['줄리 앤드류스', '크리스토퍼 플러머', '엘레노 파커']",https://movie-phinf.pstatic.net/20161124_209/1479966118269WuVYF_JPEG/movie_image.jpg,33530,"[113165, 37759, 68258, 131637, 129096, 39804, 109626, 78672, 139674]","음악을 사랑하는 말괄량이 견습 수녀 ‘마리아’는 원장 수녀의 권유로 해군 명문 집안 폰 트랩가의 가정교사가 된다. ‘마리아’는 좀처럼 마음의 문을 열지 않는 폰 트랩가의 일곱 아이들에게 노래를 가르치며 점차 교감하게 되고, 엄격한 ‘폰 트랩 대령’ 역시 마음의 문을 열게 된다. 그러던 어느 날, ‘마리아’는 자신이 ‘폰 트랩 대령’을 사랑하고 있다는 사실을 깨닫게 되고, 자신만의 비밀을 간직한 채 아이들의 곁을 떠나 다시 수녀원에 들어가기로 결심하는데…","['권유', '음악', '트랩', '노래', '사랑', '마리아', '견습', '수녀원', '수녀', '가정교사']"
10002,빽 투 더 퓨쳐,"['SF', '코미디']",로버트 저메키스,"['마이클 J. 폭스', '크리스토퍼 로이드', '리 톰슨']",https://movie-phinf.pstatic.net/20150924_194/1443056454769VJKkL_JPEG/movie_image.jpg,28586,"[12482, 40208, 118384, 125417, 30889, 36565, 64161, 35071, 39619]","힐 밸리(Hill Valley)에 사는 주인공 마티 맥플라이(Marty McFly: 마이클 J. 폭스 분)는 록큰롤, 스케이트보드, 그리고 자동차를 좋아하는 명랑 쾌할한 고교생으로, 아버지 죠지(George Douglas McFly: 크리스핀 글로버 분)와 어머니 로레인(Lorraine Baines: 리아 톰슨 분), 그리고 형과 누나가 있는 가정의 평범한 청소년이다. 평소 친하게 지내던 괴상한 발명가 에메트 브라운 박사(Dr. EmmDr. Emmett L. ""Doc"" Brown: 크리스토퍼 로이드 분)가 스포츠카 드로리안(DeLorean)을 개조해 타임머신을 만들지만, 뜻밖의 사고로 브라운 박사가 테러범들에게 총을 맞고 위험해진 마티는 급기야 30년 전으로 간다.극장 간판에는 2류 배우인 로널드 레이건이 보이고 청년인 아버지와 어머니를 보게 된다. 그러나 젊은 아버진 여전히 멍청하고, 무엇보다 어머니가 미래의 아들인 마티를 좋아해 야단이다. 마티가 미래로 가는 것을 도와 줄 사람은 30년 전인 젊은 브라운 박사뿐. 댄스 파티가 열리는 날에 아버지와 어머니가 만났던 것을 기억한 마티는 두 사람을 결합시키고자 어머니와 파티장으로 간다. 그런데, 심술장이 밥(Biff Tannen: 토마스 F. 윌슨 분)이 나타나 어머니를 겁탈하려 하나 화가 난 아버지가 일격에 때려 눕혀 그때부터 소심했던 아버지의 성격이 바낀다. 무사히 부모님은 만나 마티의 존재는 없었지지 않지만 마티의 '미래로의 귀환(Back to the future)'이 어려워지는 사태를 맞는데....","['청년', '가정', '로널드', '파티', '아버지', '록큰롤', '스포츠카', '고교생', '발명가', '부모님']"
17159,포레스트 검프,"['드라마', '코미디']",로버트 저메키스,['톰 행크스'],https://movie-phinf.pstatic.net/20160901_187/1472711688297YP2jH_JPEG/movie_image.jpg,31710,"[70651, 70615, 69339, 39619, 36957, 114249, 74565, 63017, 12482]","불편한 다리, 남들보다 조금 떨어지는 지능을 가진 외톨이 소년 ‘포레스트 검프’ 헌신적이고 강인한 어머니의 보살핌과 콩깍지 첫사랑 소녀 ‘제니’와의 만남으로 사회의 편견과 괴롭힘 속에서도 따뜻하고 순수한 마음을 지니고 성장한다.여느 날과 같이 또래들의 괴롭힘을 피해 도망치던 포레스트는 누구보다 빠르게 달릴 수 있는 자신의 재능을 깨닫고 늘 달리는 삶을 살아간다. 포레스트의 재능을 발견한 대학에서 그를 미식축구 선수로 발탁하고, 졸업 후에도 뛰어난 신체능력으로 군에 들어가 누구도 예상치 못한 성과를 거둬 무공훈장을 수여받는 등 탄탄한 인생 가도에 오르게 된 포레스트.하지만 영원히 행복할 것만 같았던 시간도 잠시, 어머니가 병에 걸려 죽음을 맞이하고 첫사랑 제니 역시 그의 곁을 떠나가며 다시 한번 인생의 전환점을 맞이하게 되는데… 과연, 포레스트는 진정한 삶의 행복을 발견할 수 있을까?진정한 삶의 가치와 의미를 제시하는 감동 바이블!올 가을, 다시 한번 세상에서 가장 눈부신 달리기가 시작된다! “Run! Forrest Run!”","['능력', '편견', '첫사랑', '헌신', '지능', '가치', '무공훈장', '재능', '행복', '괴롭힘']"
106360,위대한 쇼맨,"['드라마', '뮤지컬']",마이클 그레이시,"['휴 잭맨', '잭 에프론', '미셸 윌리엄스']",https://movie-phinf.pstatic.net/20171218_47/1513561221134wvRja_JPEG/movie_image.jpg,36976,"[36957, 39619, 34969, 74565, 35071, 64161, 31267, 96910, 159516]","쇼 비즈니스의 창시자이자, 꿈의 무대로 전세계를 매료시킨 남자‘바넘’의 이야기에서 영감을 받아 탄생한 오리지널 뮤지컬 영화 . 이후 다시 뮤지컬 영화로 돌아온 휴 잭맨부터 잭 에프론, 미셸 윌리엄스, 레베카 퍼거슨, 젠다야까지할리우드 최고의 배우들이 합류해 환상적인 앙상블을 선보인다.여기에  제작진과  작사팀의 합류로더욱 풍성해진 비주얼과 스토리, 음악까지 선보일 은‘우리는 누구나 특별하다’는 메시지로 관객들에게 재미는 물론, 감동까지 선사할 것이다.THIS IS ME! 우리는 누구나 특별하다!","['탄생', '무대', '재미', '영감', '배우', '비즈니스', '매료', '창시자', '할리우드', '뮤지컬']"
18847,타이타닉,"['멜로/로맨스', '드라마']",제임스 카메론,"['레오나르도 디카프리오', '케이트 윈슬렛']",https://movie-phinf.pstatic.net/20181129_107/1543452551390CN9TW_JPEG/movie_image.jpg,37630,"[40208, 45719, 35071, 63485, 118954, 12918, 72043, 39619, 74610]","우연한 기회로 티켓을 구해 타이타닉호에 올라탄 자유로운 영혼을 가진 화가 잭(레오나르도 디카프리오)은 막강한 재력의 약혼자와 함께 1등실에 승선한 로즈(케이트 윈슬렛)에게 한 눈에 반한다. 진실한 사랑을 꿈꾸던 로즈 또한 생애 처음 황홀한 감정에 휩싸이고, 둘은 운명 같은 사랑에 빠지는데…","['케이트', '재력', '막강', '티켓', '레오나르도', '감정', '우연', '타이타닉호', '사랑', '약혼자']"
29217,글래디에이터,"['액션', '드라마']",리들리 스콧,"['러셀 크로우', '호아킨 피닉스', '코니 닐슨']",https://movie-phinf.pstatic.net/20130419_151/1366338731242XqgJS_JPEG/movie_image.jpg,342,"[102272, 12918, 70651, 116234, 88253, 157178, 61095, 140787, 34969]","{절정기의 로마제국은 그 영토가 광대하여 아프리카 사막에서 잉글랜드 북쪽까지 걸쳐 있었다. 그 당시 세계는 그 총인구의 1/4이 로마 황제의 지배 하에 있었다. 때는 서기 180년, 마르커스 아우렐리우스(Marcus Aurelius) 황제의 12년에 걸친 게르마니아(Germania) 정벌이 거의 마무리되던 무렵이었다. 마지막 하나 남은 적의 요새만 함락하면 이제 로마 제국은 평화가 온다.} 평화로운 '5현제 시대'가 막바지에 이른 서기 180년 로마. 어두운 삼림. 수백명의 부대가 숨을 죽이고 서 있다. 마치 폭풍전야와 같이. 장군의 신호가 울리고 거대한 함성소리와 함께 하늘에는 불화살, 불타는 점토 항아리가 난무하고, 땅위는 수많은 병사들의 피로 물든다. 철인(哲人) 황제 마르쿠스 아우렐리우스(Marcus Aurelius: 리차드 해리스 분)가 아들처럼 친애하는 장군 막시무스(General Maximus: 러셀 크로우 분)는 다뉴브 강가 전투에서 대승한다. 죽을 날이 머지않은 황제 마르쿠스 아우렐리우스는 막시무스를 총애하여, 아들이 아닌 그에게 왕위를 넘겨주기로 한다. 그러나 황제의 아들 코모두스는 이에 질투와 분노를 느껴 급기야 황제를 살해한다. 왕좌를 이어받은 코모두스는 막시무스와 그의 가족을 죽이라고 명령한다. 가족을 모두 잃고 혼자 겨우 살아남게 된 막시무스는 노예로 전락하고, 투기장의 검투사로 매일 훈련을 받는다. 그에게 남은 건 오로지 새로 즉위한 황제 코모두스에 대한 복수 뿐. 검투사로서 매 경기마다 승리로 이끌면서 살아남자 그의 명성과 인기는 날로 높아간다. 로마로 돌아온 그는 아내와 아들을 죽인 코모두스에 대한 복수를 다짐한다. 그러던 어느날, 오래전 사랑했던 황제의 누이 루실라(Lucilla: 코니 닐슨 분)를 다시 만나게 된다. 어느 새 민중의 영웅이 된 막시무스. 코모두스는 그가 아직 살아있음을 알고 분노하지만 민중이 두려워 그를 죽이지 못한다. 드디어 막시무스는 예전의 부하들과 은밀히 만나 사랑하는 아내와 아들, 존경하던 황제를 살해한 난폭한 황제 코모두스에 대한 복수를 결의한다. 아직도 막시무스를 사랑하고 있는 루실라는 동생 코모두스를 배신하고 막시무스의 반란을 도우려 하는데.","['아우렐리우스', '마지막', '마르쿠스', '잉글랜드', '사랑', '제국', '황제', '로마', '평화', '로마제국']"
