movie_code,movie_title,movie_genre,movie_director,movie_actor,movie_poster,movie_trailer,similar_movie,movie_story,story_keyword
39568,스노우 워커,"['모험', '드라마']",찰스 마틴 스미스,"['배리 페퍼', '아나벨라 피가턱']",https://movie-phinf.pstatic.net/20111221_86/1324462128333MiTTI_JPEG/movie_image.jpg,3687,"[29223, 96910, 71486, 31475, 35071, 66158, 187351, 129096, 72043]","북극해를 비행하는 베테랑 비행사인 '찰리'는 의욕이 넘치고 매사 자신만만한 남자. 자신의 생일날에도 평소와 다름 없이 비행을 나섰다가 우연히 이뉴잇 일행과 마주친다. 아픈 소녀를 도와 달라고 간청하는 이뉴잇들. 그들의 애처로운 눈빛에도 불구하고 야속하게 등을 돌리던 찰리는, 그들로부터 상아를 건네 받고서야 마음을 고쳐 먹는다.투명한 눈빛을 가진 순수한 영혼의 이뉴잇 소녀와 함께 비행에 오르게 된 찰리. 하지만 얼마 못가 갑작스런 요동과 함께 비행기가 허허벌판 설원으로 추락하고 만다. 기적적으로 목숨을 건진 두 사람. 하지만 상황은 암담하기만 하다. 산산 조각난 비행기 잔해 속에서 남은 것이라곤 망가진 라디오와 소량의 식량 뿐. 게다가 두 사람은 서로 말도 통하지 않는다. 끝도 없이 황량하게 펼쳐진 설원을 보고 망연자실한 찰리. 하지만 소녀는 오히려 담담하기만 한데...","['산산', '의욕', '라디오', '생일', '기적', '북극해', '찰리', '비행사', '비행', '비행기']"
37488,무간도 3 - 종극무간,"['범죄', '드라마']",유위강,"['유덕화', '량차오웨이', '여명']",https://movie-phinf.pstatic.net/20111222_138/1324545572672gcu14_JPEG/movie_image.jpg,2737,"[64161, 36957, 68258, 37439, 74565, 31231, 39908, 31788, 39619]","2001년. 서로 엇갈린 운명의 두 남자가 있었다! 경찰 내부에 침투한 조직 스파이 유건명(유덕화 扮), 그리고 범죄조직 삼합회의 소탕을 위해 침투한 경찰 스파이 진영인(양조위 扮). 서로 엇갈린 운명을 살아가는 이들은 날이 갈수록 자신의 정체성에 혼란을 느낀다. 삼합회에 점점 깊숙이 개입될수록 극심한 정신적 고통에 시달리던 진영인은 정신과 상담의 닥터 리(진혜림 扮)를 만나게 되면서 마음의 상처를 조금씩 덜어나간다. 삼합회에 위장 잠입한지 10년… 삼합회의 보스 한침(증지위 扮)의 확실한 신임을 얻기 위해 진영인은 심등(진도명 扮)을 제거하기 위한 미끼가 되기로 결심 하는데… 2002년 12월. 운명은 점차 비극을 향해 내닫는다. 한편, 경찰에 잠입한 10년동안 유건명은 가장 뛰어난 강력반 요원으로 자리를 잡아나가고, 점점 완전한 경찰이 되어가면서 조직에서 완전히 손을 빼고 싶어한다. 삼합회 보스의 범죄를 캐내는 대대적인 작전 중 서로의 존재를 눈치채게 된 유건명과 진영인. 숨막히는 추격끝에 둘은 서로에게 총을 겨누지만, 진영인은 결국 또다른 조직스파이에 의해 비극적인 죽음을 맞이하게 되는데… 2004년. 마침내 모습을 드러내는 운명의 결말. 과연 진실은 무엇인가? 진영인의 죽음이후 한직으로 ?i겨나 경찰 내부 조사의 대상이 된 유건명. 힘겨운 시간을 보내던 유건명은 경찰 내부 최고의 엘리트인 보안부 반장 양금영(여명 扮)을 보며 자신의 지난 전성기를 떠올린다. 하지만 어느 순간 유건명은 양금영에게 수상한 기운을 느끼고 비밀리에 자체 조사를 시작하게 된다. 양금영에 대한 조사를 시작한 지 얼마 되지 않아 유건명은, 삼합회에 맞서는 또다른 범죄조직의 보스 심등과 양금영이 얽혀 있는 놀라운 비밀들을 마주하게 되는데…","['죽음', '비밀', '수상한', '스파이', '경찰', '비극', '혼란', '범죄', '비밀리', '고통']"
140731,분노의 질주: 더 익스트림,"['액션', '범죄', '스릴러']",F. 게리 그레이,"['빈 디젤', '드웨인 존슨', '샤를리즈 테론']",https://movie-phinf.pstatic.net/20200310_91/1583805533463Yqyui_JPEG/movie_image.jpg,34451,"[74565, 39157, 103535, 44885, 70254, 65242, 71901, 37487, 51132]","마침내 평화로운 일상으로 돌아온 리더 ‘도미닉’(빈 디젤)과 멤버들.그러던 어느 날, 멤버들은 도미닉이 첨단 테러 조직의 리더 ‘사이퍼’(샤를리즈 테론)와 함께 사상 최악의 테러를 계획하고 있음을 알게 된다.리더의 배신으로 위기에 놓인 멤버들은 한때 팀을 모두 전멸시키려 했던 ‘데카드 쇼’(제이슨 스타뎀)까지 영입해최악의 적이 되어버린 도미닉과의 피할 수 없는 대결을 앞두게 되는데…","['리더', '테론', '위기', '계획', '스타', '마침내', '전멸', '최악', '테러', '배신']"
10086,미션,['드라마'],롤랑 조페,"['로버트 드 니로', '제레미 아이언스']",https://movie-phinf.pstatic.net/20191015_291/1571105622981nXDR4_JPEG/movie_image.jpg,34299,"[32240, 106522, 74003, 76347, 103535, 12918, 139674, 31267, 118384]","18세기, 극단의 시대.원주민 과라니족의 마을로 선교활동을 온‘가브리엘 신부’와 살인 복역수 ‘멘도자’는포르투갈 영토에 편입되어 죽음의 위기에 처한 원주민들을 목격한다.무력 VS 비폭력이들을 지키기 위해 서로 다른 선택을 감행하는 두 사람,과연 두 사람은 그들을 지켜낼 수 있을까?","['무력', '살인', '위기', '비폭력', '죽음', '과라니족', '원주민', '포르투갈', '신부', '선교']"
183866,담보,['드라마'],강대규,"['성동일', '하지원', '김희원']",https://movie-phinf.pstatic.net/20200929_240/1601370752754trKxu_JPEG/movie_image.jpg,47432,"[17773, 184318, 71546, 66069, 60753, 83213, 36666, 65840, 118384]","1993년 인천거칠고 까칠한 사채업자 두석(성동일)과 종배(김희원)는떼인 돈 받으러 갔다가 얼떨결에 9살 승이(박소이)를 담보로 맡게 된다.“담보가 무슨 뜻이에요?”뜻도 모른 채 담보가 된 승이와 승이 엄마의 사정으로 아이의 입양까지 책임지게 된 두석과 종배.하지만 부잣집으로 간 줄 알았던 승이가 엉뚱한 곳에 있다는 것을 알게 된 두 사람은승이를 데려와 돌보게 된다.예고 없이 찾아온 아이에게 인생을 담보 잡힌 두석과 종배.빚 때문에 아저씨들에게 맡겨진 담보 승이.두석, 종배, 승이 세 사람은 어느덧 서로에게 특별한 존재가 되는데..돈 받으러 갔다가 인생의 보물을 만났다!","['서로', '사채', '아저씨', '엄마', '보물', '업자', '부잣집', '김희원', '인천', '입양']"
60530,미스 리틀 선샤인,"['코미디', '드라마', '모험']",조나단 데이턴,"['스티브 카렐', '토니 콜렛', '그렉 키니어']",https://movie-phinf.pstatic.net/20111222_108/1324495565302Pc8wc_JPEG/movie_image.jpg,6398,"[31913, 109642, 38083, 47428, 31231, 51132, 81967, 33513, 109626]","대학 강사인 가장 리차드(그렉 키니어)는 본인의 절대무패 9단계 이론을 팔려고 엄청나게 시도하고 있지만 별로 성공적이지 못하다. 이런 남편을 경멸하는 엄마 쉐릴(토니 콜레트)은 이주째 닭날개 튀김을 저녁으로 내놓고 있어 할아버지의 화를 사고 있다. 헤로인 복용으로 최근에 양로원에서 쫓겨난 할아버지(앨런 아킨)는 15살 손자에게 섹스가 무조건 중요하다고 가르친다. 전투 조종사가 될 때까지 가족과 말하지 않겠다고 선언한 아들 드웨인(폴 다노)은 9개월째 자신의 의사를 노트에 적어 전달한다. 이 콩가루 집안에 얹혀살게 된 외삼촌 프랭크(스티브 카렐)는 게이 애인한테 차인 후에 자살을 기도해 병원에 입원했다가 방금 퇴원한 프로스트 석학이다. 마지막으로 7살짜리 막내딸 올리브(애비게일 브레슬린)는 또래 아이보다 통통한(?) 몸매지만 유난히 미인대회에 집착하며 분주하다. 그러던 어느 날, 올리브에게 캘리포니아 주에서 열리는 쟁쟁한 어린이 미인 대회인 '미스 리틀  선샤인' 대회 출전의 기회가 찾아온다. 그리고 딸아이의 소원을 위해 온 가족이 낡은 고물 버스를 타고 1박2일 동안의 무모한 여행 길에 오르게 된다. 좁은 버스 안에서 후버 가족의 비밀과 갈등은 점점 더 커져만 가는데.. 할아버지와 올리브가 열심히 준비한 미스 리틀 선샤인 대회의 마지막 무대는 가족 모두를 그들이 절대 상상할 수 없었던 방식으로 변화시키게 된다. 과연 후버 가족에겐 무슨 일이 생긴 것 일까?","['무패', '쟁쟁', '미인대회', '애인', '갈등', '전투', '자살', '집착', '섹스', '경멸']"
90589,엣지 오브 투모로우,"['액션', 'SF']",더그 라이만,"['톰 크루즈', '에밀리 블런트', '빌 팩스톤']",https://movie-phinf.pstatic.net/20140616_233/1402884025598j42IR_JPEG/movie_image.jpg,23708,"[74565, 51132, 71546, 37487, 31231, 39473, 34969, 47428, 12918]","가까운 미래, 미믹이라 불리는 외계 종족의 침략으로 인류는 멸망 위기를 맞는다.빌 케이지(톰 크루즈)는 자살 작전이나 다름없는 작전에 훈련이나 장비를 제대로 갖추지 못한 상태로 배정되고 전투에 참여하자마자 죽음을 맞는다. 하지만 불가능한 일이 일어난다. 그가 다시 그 끔찍한 날이 시작된 시간에 다시 깨어나 다시 전투에 참여하게 되고 다시 죽었다가 또 다시 살아나는 것. 외계인과의 접촉으로 같은 시간대를 반복해서 겪게 되는 타임 루프에 갇히게 된 것이다.","['훈련', '시간', '미래', '침략', '전투', '외계', '죽음', '자살', '멸망', '외계인']"
44728,오만과 편견,"['드라마', '멜로/로맨스']",조 라이트,"['키이라 나이틀리', '매튜 맥퍼딘', '브렌다 블레신']",https://movie-phinf.pstatic.net/20111223_136/1324574908649wgRJa_JPEG/movie_image.jpg,4966,"[93094, 65242, 10020, 56447, 39619, 123268, 71509, 31231, 113303]","아름답고 매력적인 '엘리자베스(키이라 나이틀리)'는 사랑하는 사람과의 결혼을 믿는 자존심 강하고 영리한 소녀. 좋은 신랑감에게 다섯 딸들을 시집 보내는 것을 남은 인생의 목표로 생각하는 극성스러운 어머니와 자식들을 극진히 사랑하는 너그러운 아버지와 함께 화기애애한 '베넷가(家)'의 다섯 자매 중 둘째이다. 조용한 시골에 부유하고 명망있는 가문의 신사 '빙리'와 그의 친구 '다아시(매튜 맥파든)'가 여름 동안 대저택에 머물게 되고, 대저택에서 열리는 댄스 파티에서 처음 만난 '엘리자베스'와 '다아시'는 서로에게 눈을 떼지 못한다. 하지만 자존심 강한 '엘리자베스'와 무뚝뚝한 '다아시'는 만날 때 마다 서로에게 속마음을 드러내지 않고 사랑의 줄다리기를 하는데, '다아시'는 아름답고 지적인 그녀의 매력에 점점 빠져들고 폭우가 쏟아지는 날, 비바람이 몰아치는 언덕에서 가슴 속 깊은 곳에 담아둔 뜨거운 사랑을 그녀에게 고백한다. 결혼의 조건은 오직 진정한 사랑이라고 믿는 '엘리자베스'는, '다아시'가 자신의 친구 '빙리'와 그녀의 언니 '제인'의 결혼을 '제인'이 명망있는 가문 출신이 아니라는 이유로 반대한 것을 알게 되자, 그를 오만하고 편견에 가득 찬 속물로 여기며 외면하는데... 서로에 대한 오해와 편견에 빠져 눈이 멀어있는 '엘리자베스'와 '다아시'는 과연 서로의 진심을 알고 사랑을 이룰 수 있을까...","['신랑감', '어머니', '지적', '매력', '언니', '가문', '자존심', '사랑', '결혼', '자매']"
74565,스타트렉 다크니스,"['액션', '모험', 'SF']",J.J. 에이브럼스,"['크리스 파인', '재커리 퀸토', '조 샐다나']",https://movie-phinf.pstatic.net/20130529_15/1369795670692krUjX_JPEG/movie_image.jpg,20601,"[70254, 39619, 36957, 47428, 31231, 34969, 51132, 157178, 187351]","우주를 항해하던 거대함선 USS 엔터프라이즈호를 이끌고 귀환한 ‘커크’ 함장(크리스 파인). 하지만 누군가의 무자비한 공격으로 인해 전세계는 거대한 위기에 빠지고, 스타플릿 내부까지 공격 당하며 공포와 충격은 더욱 커져만 간다. 테러의 주인공이 다름아닌 스타플릿의 최정예 대원 ‘존 해리슨’(베네딕트 컴버배치)라는 사실이 밝혀지고, 그의 분노가 극대화될 수록 세상은 걷잡을 수 없는 혼란에 휩싸이기 시작한다. 내부의 적에 의해 절체절명의 위기를 맞게 된 엔터프라이즈호! 커크 함장과 대원들은 초토화된 전쟁터 한복판에서 인류의 미래가 걸린 선택의 기로에 놓이게 되는데...!인류 최대의 위협, 그의 분노를 막아라!","['전세계', '우주', '위협', '공포', '혼란', '테러', '스타플릿', '전쟁', '공격', '분노']"
129046,리틀 보이,"['드라마', '전쟁']",알레한드로 몬테베르드,"['제이콥 살바티', '에밀리 왓슨', '캐리 히로유키 타카와']",https://movie-phinf.pstatic.net/20151110_65/1447132516092vRV8w_JPEG/movie_image.jpg,29266,"[70615, 39619, 131637, 169240, 31231, 31267, 36666, 63379, 71509]","키 99cm…더 이상 자라지 않는 키 때문에 ‘리틀 보이’라고 불리는 ‘페퍼’,친구들로부터 놀림 받기 일쑤인 그는전쟁에 나간 단 하나뿐인 소중한 친구, 아빠가 돌아오기만을 손꼽아 기다린다.어느 날, 마술쇼에 간 ‘페퍼’는 우연히 오른 무대에서 물건을 움직이는 특별한 능력을 발견하게 되고 이 능력만 있으면 전쟁을 끝내고, 아빠도 돌아올 수 있다고 믿게 된다.‘페퍼’는 자신의 능력과 믿음을 키워나가고 급기야 지진을 일으켜 자신을 비웃던 동네 사람들을 깜짝 놀라게 만드는데…과연, ‘페퍼’는 전쟁을 끝낼 수 있을까?","['아빠', '무대', '믿음', '능력', '친구', '놀림', '지진', '전쟁', '마술', '페퍼']"
159516,인비저블 게스트,"['범죄', '미스터리', '스릴러']",오리올 파울로,"['마리오 카사스', '바바라 레니', '호세 코로나도']",https://movie-phinf.pstatic.net/20170828_179/1503887362732snsIK_JPEG/movie_image.jpg,35746,"[140787, 71509, 84414, 31231, 17150, 51132, 103331, 39619, 31913]","의문의 습격으로 살해 당한 ‘로라’‘아드리안’은 연인의 죽음에 절망하고, 범인은 흔적도 없이 사라졌다.  유력한 용의자로 누명을 쓴 ‘아드리안’은 승률 100%의 변호사 ‘버지니아’를 선임한다.그리고 자신의 무죄를 입증하기 위해 고군분투하던 중 과거 그와 ‘로라’가 은폐한 교통사고와 숨겨진 연관성을 찾게 되는데…남은 시간은 단 3시간, 사건을 재구성해 무죄를 입증해야 한다!","['습격', '범인', '버지니아', '용의자', '분투', '교통사고', '승률', '연인', '죽음', '절망']"
175366,나의 특별한 형제,"['드라마', '코미디']",육상효,"['신하균', '이광수', '이솜']",https://movie-phinf.pstatic.net/20190404_182/1554340290133Khnb5_JPEG/movie_image.jpg,42285,"[84414, 140787, 36957, 47428, 39473, 68258, 103331, 74565, 34969]","비상한 두뇌를 가졌지만 동생 ‘동구’ 없이는 아무 데도 못 가는 형 ‘세하’(신하균),뛰어난 수영실력을 갖췄지만 형 ‘세하’ 없이는 아무것도 못 하는 동생 ‘동구’(이광수).이들은 피 한 방울 섞이지 않았지만 20년 동안 한 몸처럼 살아온 ‘특별한 형제’다.어느 날 형제의 보금자리 ‘책임의 집’을 운영하던 신부님이 돌아가시자모든 지원금이 끊기게 되고, 각각 다른 장애를 가진 두 사람은 헤어질 위기에 처하고 만다.세하는 ‘책임의 집’을 지키고 동구와 떨어지지 않기 위해구청 수영장 알바생이자 취준생 ‘미현’(이솜)을 수영코치로 영입하고,동구를 수영대회에 출전시켜 사람들의 이목을 집중시키는 데 성공한다.헤어지지 않을 수 있다는 희망을 본 것도 잠시,예상치 못한 인물이 형제 앞에 등장하면서 형제는 새로운 위기를 겪게 되는데...!","['대회', '희망', '책임', '보금자리', '위기', '코치', '장애', '신부', '동생', '형제']"
191545,라스트 듀얼: 최후의 결투,"['액션', '스릴러']",리들리 스콧,"['맷 데이먼', '아담 드라이버', '조디 코머']",https://movie-phinf.pstatic.net/20210930_23/1632986239409z0czk_JPEG/movie_image.jpg,50691,"[159516, 51777, 38083, 31231, 95808, 71509, 66728, 36957, 51132]","부조리한 권력과 야만의 시대, 14세기 프랑스.유서 깊은 ‘카루주’ 가의 부인 ‘마르그리트’는 남편 ‘장’이 집을 비운 사이,불시에 들이닥친 ‘장’의 친구 ‘자크’에게 씻을 수 없는 모욕을 당한다.용서받지 못할 짓을 저지른 ‘자크’는 ‘마르그리트’에게 침묵을 강요하지만,‘마르그리트’는 자신이 입을 여는 순간 감내해야 할불명예를 각오하고 용기를 내어 ‘자크’의 죄를 고발한다.권력을 등에 업은 ‘자크’는 강력하게 자신의 결백을 주장하고,가문과 자신의 명예를 지키기 위한 ‘장’은승리하는 사람이 곧 정의로 판정 받게 되는 결투 재판을 요청하기에 이른다.‘장’이 결투에서 패할 경우,‘마르그리트’는 즉시 사형에 처해지는 운명에 놓이게 되는데…단 한번의 결투가 세 사람의 운명을 가른다!","['정의', '남편', '부인', '내해', '침묵', '불명예', '결백', '용서', '결투', '모욕']"
158180,그것만이 내 세상,"['코미디', '드라마']",최성현,"['이병헌', '윤여정', '박정민']",https://movie-phinf.pstatic.net/20180122_124/1516586697016QmvO1_JPEG/movie_image.jpg,37450,"[68258, 39479, 79315, 71509, 74565, 31231, 74003, 103331, 36666]","한때는 WBC 웰터급 동양 챔피언이었지만지금은 오갈 데 없어진 한물간 전직 복서 '조하'(이병헌).우연히 17년 만에 헤어진 엄마 '인숙'(윤여정)과 재회하고,숙식을 해결하기 위해 따라간 집에서듣지도 보지도 못했던 뜻밖의 동생 '진태'(박정민)와 마주한다.난생처음 봤는데… 동생이라고?!라면 끓이기, 게임도 최고로 잘하지만무엇보다 피아노에 천재적 재능을 지닌 서번트증후군 진태.조하는 입만 열면 ""네~"" 타령인 심상치 않은 동생을 보자 한숨부터 나온다.하지만 캐나다로 가기 위한 경비를 마련하기 전까지만 꾹 참기로 결심한 조하는결코 만만치 않은 불편한 동거생활을 하기 시작하는데…살아온 곳도, 잘하는 일도, 좋아하는 것도 다른두 형제가 만났다!","['재능', '해결', '윤여정', '챔피언', '천재', '박정민', '게임', '피아노', '동생', '형제']"
74632,분노의 질주: 언리미티드,"['액션', '범죄', '드라마', '스릴러']",저스틴 린,"['빈 디젤', '폴 워커', '드웨인 존슨']",https://movie-phinf.pstatic.net/20111223_33/1324635262035CqxzD_JPEG/movie_image.jpg,14815,"[51132, 68258, 74565, 39473, 36957, 65113, 66728, 71509, 66253]","경찰이었던 브라이언(폴 워커)은 미아(조다나 브류스터)와 함께 도미닉(빈 디젤)을 탈옥시키고, 함께 국경을 넘어 브라질의 리우 데 자네이루로 도주한다. 자유를 위한 마지막 한방, 최후의 미션을 준비하는 멤버들은 이들을 죽음으로 몰아 놓으려는 음모에 휩싸여 궁지에 몰리게 되는데... 한편 절대 타겟을 놓치지 않는 냉철한 정부 요원 홉스(드웨인 존슨)는 도미닉과 브라이언을 쫓던 중 이들의 둘러싼 커다란 음모가 있음을 직감하게 되고 이들간의 쫓고 쫓기는 숨막히는 대결이 시작된다.","['존슨', '미션', '시작', '대결', '탈옥', '브라이언', '음모', '타겟', '죽음', '브라질']"
39524,스윙걸즈,['코미디'],야구치 시노부,"['우에노 주리', '히라오카 유타', '칸지야 시호리']",https://movie-phinf.pstatic.net/20111222_1/1324540931174CMGhD_JPEG/movie_image.jpg,5028,"[47364, 139674, 39584, 46153, 191917, 66069, 34969, 158180, 74003]","지루한 여름방학, 보충 수업을 받고 있는 13명의 낙제 여고생들이 합주부에게 도시락을 전해주자는 토모코(우에노 쥬리)의 제안을 구실로 땡땡이를 감행한다. 그러나 전달된 도시락이 여름 땡볕에 상해 합주부 전원이 식중독에 걸리는 대사건이 발생한다. 도시락을 못 받은 나카무라 제외한 합주부 전원이 병원에 입원한 상태. 낙제생 소녀들은 보충수업 땡땡이를 위해 그 자리를 대신하기로 결심하며 재즈의 세계에 발을 담그게 된다.식중독에 걸렸던 합주부원들이 제자리로 돌아오자 토모코를 비롯한 못말리는 낙제소녀들은 다시 일상으로 돌아오게 되고 잠시나마 경험했던 재즈에 재미를 느낀 이들은 자신만의 스윙밴드, 일명 ‘스윙걸즈’를 조직한다. 그러나 문제는 연주할 악기가 없다는 사실! 악기를 구입하기 위해 소녀들은 좌충우돌 기상천외 아르바이트를 시작하게 되고 막상 악기를 구해도 번듯히 연습할 공간조차 없어 해산위기에 처한 스윙걸즈…  대책없이 발랄했던 소녀들의 스윙밴드 도전은 성공할 것인가?","['여고생', '위기', '낙제', '해산', '여름', '병원', '소녀', '주부', '여름방학', '식중독']"
70562,시,['드라마'],이창동,['윤정희'],https://movie-phinf.pstatic.net/20111223_172/1324612498347Kl4HY_JPEG/movie_image.jpg,12722,"[69339, 61056, 36957, 75378, 104331, 71546, 37386, 30076, 10200]","한강을 끼고 있는 경기도의 어느 작은 도시, 낡은 서민 아파트에서 중학교에 다니는 손자와 함께 살아가는 미자. 그녀는 꽃 장식 모자부터 화사한 의상까지 치장하는 것을 좋아하고 호기심도 많은 엉뚱한 캐릭터다   미자는 어느 날 동네 문화원에서 우연히 '시' 강좌를 수강하게 되며 난생 처음으로 시를 쓰게 된다. 시상을 찾기 위해 그 동안 무심히 지나쳤던 일상을 주시하며 아름다움을 찾으려 하는 미자. 지금까지 봐왔던 모든 것들이 마치 처음 보는 것 같아 소녀처럼 설레 인다. 그러나, 그녀에게 예기치 못한 사건이 찾아오면서 세상이 자신의 생각처럼 아름답지만은 않다는 것을 알게 되는데…","['일상', '한강', '서민', '호기심', '장식', '소녀', '문화원', '손자', '강좌', '중학교']"
189623,남매의 여름밤,['드라마'],윤단비,"['최정운', '양흥주', '박현영']",https://movie-phinf.pstatic.net/20200721_100/1595307510654a6eNC_JPEG/movie_image.jpg,47105,"[48742, 101950, 36992, 51132, 39436, 80774, 92125, 159516, 64242]","방학 동안, 아빠와 함께 할아버지 집에서 지내게 된 남매 옥주와 동주,그렇게 오래된 2층 양옥집에서의 여름이 시작되고한동안 못 만났던 고모까지 합세하면서기억에 남을 온 가족의 이야기가 펼쳐진다.제24회 토론토릴아시안국제영화제 오슬러 최우수 장편 영화상 (2020)제17회 홍콩아시안영화제 뉴탤런트상 (2020)제38회 이탈리아토리노영화제 최고 작품상 (2020)","['남매', '합세', '할아버지', '국제', '토리노', '오슬러', '동주', '동안', '옥주', '탤런트']"
127398,가디언즈 오브 갤럭시 VOL. 2,"['액션', 'SF']",제임스 건,"['크리스 프랫', '조 샐다나', '데이브 바티스타']",https://movie-phinf.pstatic.net/20170329_6/1490752948552vH5G8_JPEG/movie_image.jpg,33980,"[31231, 66728, 74565, 147945, 66520, 36565, 38097, 51132, 31913]",최강 빌런 ‘타노스’에 맞서 은하계를 구하고 최고의 해결사로 등극한 ‘가.오.갤’ 멤버들.하지만 외계 여사제 ‘아이샤’가 맡긴 임무를 수행하던 중 실수로 또 다시 쫓기는 신세로 전락한다.한편 자신에게 숨겨진 힘의 원천에 대해 고민하던 리더 ‘스타로드’는 갑작스레 나타난 아버지로 인해 또 다른 위기에 빠지게 되는데…,"['임무', '해결사', '리더', '아버지', '스타로드', '위기', '은하계', '사제', '외계', '실수']"
64354,행복을 찾아서,['드라마'],가브리엘 무치노,"['윌 스미스', '제이든 스미스']",https://movie-phinf.pstatic.net/20171117_127/151088206856123qcc_JPEG/movie_image.jpg,36906,"[25906, 39157, 127361, 157178, 103331, 31913, 12918, 31159, 64126]","한물간 의료기기를 판매하는 세일즈맨 크리스 가드너(윌 스미스)는 물건을 팔기 위해 매일 최선을 다하지만 일은 마음대로 되지 않는다.결국 아내까지 집을 떠나고, 길거리로 나앉는 신세로 전락한다.하지만 하나뿐인 아들 ‘크리스토퍼’(제이든 스미스)를 위해서라면살아남아야 하는 그에게 인생 마지막 기회가 다가온다.60대 1이라는 엄청난 경쟁 속에서반드시 행복해져야 하는 그의 절실한 도전이 시작되는데…","['크리스토퍼', '최선', '스미스', '아내', '인생', '도전', '판매', '의료기기', '절실', '경쟁']"
